title,price,stock,image,category
Anonymous,46.82,In stock,../media/cache/fb/75/fb75a0ce3e0b01fa3852806c6d1f1af6.jpg,Four
Amy Meets the Saints and Sages,18.46,In stock,../media/cache/00/53/0053efa8515b8e2ad9b029c298766e9f.jpg,Three
Amid the Chaos,36.58,In stock,../media/cache/52/46/524655fade1d9fe1475395a3eaff827a.jpg,One
Amatus,50.54,In stock,../media/cache/8f/92/8f92c3b5dc8f5c1a23324bda7477b19c.jpg,Five
Agnostic: A Spirited Manifesto,12.51,In stock,../media/cache/9f/fc/9ffc43826233092d2acb4414f86627eb.jpg,Five
Zealot: The Life and Times of Jesus of Nazareth,24.7,In stock,../media/cache/3d/60/3d6003fc37b842a07c2dbe28e47448e1.jpg,Three
You (You #1),43.61,In stock,../media/cache/d6/97/d697268540fa982f4dce39f61ed3a342.jpg,Five
"Wonder Woman: Earth One, Volume One (Wonder Woman: Earth One #1)",37.34,In stock,../media/cache/19/39/19396172462f4cc0504d4e6e8b0e1647.jpg,Four
Wild Swans,14.36,In stock,../media/cache/bb/72/bb723ad463531c602ad8bcb244253bf3.jpg,Two
Why the Right Went Wrong: Conservatism--From Goldwater to the Tea Party and Beyond,52.65,In stock,../media/cache/db/1b/db1babd3c09b84da800b0e9897fe0097.jpg,Four
Whole Lotta Creativity Going On: 60 Fun and Unusual Exercises to Awaken and Strengthen Your Creativity,38.2,In stock,../media/cache/ba/36/ba368dfb2b6ae9979ff59d049c626167.jpg,Four
What's It Like in Space?: Stories from Astronauts Who've Been There,19.6,In stock,../media/cache/43/b7/43b70859e93901b019791cef86539ffc.jpg,Two
"We Are Robin, Vol. 1: The Vigilante Business (We Are Robin #1)",53.9,In stock,../media/cache/66/d6/66d6d2b4c0acfa8f40ad0285186ed2d8.jpg,One
Walt Disney's Alice in Wonderland,12.96,In stock,../media/cache/28/50/2850439c2ba103fb69dba9cd2dd9f0c2.jpg,Five
V for Vendetta (V for Vendetta Complete),37.1,In stock,../media/cache/cc/8f/cc8fb914bfee31a7903a5cabaae64796.jpg,Four
Until Friday Night (The Field Party #1),46.31,In stock,../media/cache/19/cf/19cf50aea5bf0e8f4bc016f3745b3dfe.jpg,Two
"Unbroken: A World War II Story of Survival, Resilience, and Redemption",45.95,In stock,../media/cache/74/cd/74cd3f345b50452c3be6631669f13aa8.jpg,Two
Twenty Yawns,22.08,In stock,../media/cache/2b/38/2b380f77723c797c0389f978afa6db58.jpg,Two
Through the Woods,25.38,In stock,../media/cache/4c/af/4caf8f2a5ee8828d408cc8faadd3419c.jpg,Two
This Is Where It Ends,27.12,In stock,../media/cache/18/0b/180bfe1902cb3c0eb77d7c712efa2a96.jpg,Two
The Year of Magical Thinking,43.04,In stock,../media/cache/bf/e5/bfe526c22c7c08235c27a6474ebb4db9.jpg,Two
The Wright Brothers,56.8,In stock,../media/cache/02/2e/022e8b81ba1405991401bb46d6330c73.jpg,Four
The White Queen (The Cousins' War #1),25.91,In stock,../media/cache/72/d8/72d861617b6d3aababe6e61e8d3c1056.jpg,Five
The Wedding Pact (The O'Malleys #2),32.61,In stock,../media/cache/7e/67/7e67addd80caaf8a9f9e9daa9cf66bb2.jpg,Three
The Time Keeper,27.88,In stock,../media/cache/8f/f8/8ff8680dde59ea739d6978a01e4d7fe5.jpg,Five
The Testament of Mary,52.67,In stock,../media/cache/83/05/8305154438c91a02cefacf4ec8b53393.jpg,Four
The Star-Touched Queen,46.02,In stock,../media/cache/53/5e/535e2be0b423797c2cdc7d98882c820a.jpg,Five
The Songs of the Gods,44.48,In stock,../media/cache/6c/a3/6ca34db7c01e554ad17bd3be74b561e3.jpg,Five
The Song of Achilles,37.4,In stock,../media/cache/66/f7/66f79b76d6c6b64fcc8110515c454e09.jpg,Five
The Rosie Project (Don Tillman #1),54.04,In stock,../media/cache/f0/db/f0db1cf76d45f0522d4c8c3c39aa0dd8.jpg,One
The Power of Habit: Why We Do What We Do in Life and Business,16.88,In stock,../media/cache/52/df/52dfc44f48cf29e7a9e305bcb63e1899.jpg,Three
The Marriage of Opposites,28.08,In stock,../media/cache/0f/c2/0fc21ec3489cb23116778ee84f425eca.jpg,Four
The Lucifer Effect: Understanding How Good People Turn Evil,10.4,In stock,../media/cache/a6/c8/a6c8256b123493472591c5855c7de704.jpg,One
The Long Haul (Diary of a Wimpy Kid #9),44.07,In stock,../media/cache/46/bd/46bdee520b8136972262fd040533772d.jpg,One
The Loney,23.4,In stock,../media/cache/6d/10/6d10387a0175701d4ff456a0c7eee67b.jpg,One
The Literature Book (Big Ideas Simply Explained),17.43,In stock,../media/cache/9e/ea/9eea51ac4a15d18aa976be459da30c47.jpg,Three
The Last Mile (Amos Decker #2),54.21,In stock,../media/cache/37/f1/37f118b4a56d866e1e8b563759d6966c.jpg,Two
The Immortal Life of Henrietta Lacks,40.67,In stock,../media/cache/94/ac/94ac87da7b40853013093f08356efa3b.jpg,Two
The Hidden Oracle (The Trials of Apollo #1),52.26,In stock,../media/cache/b4/67/b467a4f01ca6ae8464b9425a156c7c32.jpg,Two
The Help Yourself Cookbook for Kids: 60 Easy Plant-Based Recipes Kids Can Make to Stay Healthy and Save the Earth,28.77,In stock,../media/cache/c4/dc/c4dcec6f513eaca3f0f3c748d834c46d.jpg,Three
The Guilty (Will Robie #4),13.82,In stock,../media/cache/76/de/76deee06ffe45e646c0113af01f4f401.jpg,Two
The First Hostage (J.B. Collins #2),25.85,In stock,../media/cache/38/34/3834572e651cdc14b18d348fa4875aa9.jpg,Three
The Dovekeepers,48.78,In stock,../media/cache/8f/3f/8f3f4d67e30a8129577ccc4664998345.jpg,One
The Darkest Lie,35.35,In stock,../media/cache/1d/3c/1d3c05b772ab846c111970232360d2c5.jpg,Five
The Bane Chronicles (The Bane Chronicles #1-11),44.73,In stock,../media/cache/9a/33/9a333c4a06ce187c5c9d2f5969ddcac2.jpg,Four
The Bad-Ass Librarians of Timbuktu: And Their Race to Save the World’s Most Precious Manuscripts,15.77,In stock,../media/cache/88/90/8890073a9c9e3bb696f6baa84fb4dd95.jpg,One
The 14th Colony (Cotton Malone #11),39.24,In stock,../media/cache/d9/1a/d91aae72af6c1cb2c63163acabe7895c.jpg,One
That Darkness (Gardiner and Renner #1),13.92,In stock,../media/cache/44/9e/449ed681142bc336646abee754e96639.jpg,One
Tastes Like Fear (DI Marnie Rome #3),10.69,In stock,../media/cache/3c/91/3c91d97266bd6dda322089695fb46daf.jpg,One
Take Me with You,45.21,In stock,../media/cache/d8/a4/d8a44eda7cbe7bd1207f868e9adc06f3.jpg,Three
Swell: A Year of Waves,45.58,In stock,../media/cache/10/28/1028b2cf417e49dc1c14609e437a98e0.jpg,One
Superman Vol. 1: Before Truth (Superman by Gene Luen Yang #1),11.89,In stock,../media/cache/7e/c0/7ec0e9ca6153a23b2024b7df7407ee84.jpg,Five
Still Life with Bread Crumbs,26.41,In stock,../media/cache/8e/c7/8ec7f310b74ddd7ec3c859e9b0da7389.jpg,Three
Steve Jobs,39.5,In stock,../media/cache/86/31/86313c225719ac946894d780c4ff0839.jpg,Five
Sorting the Beef from the Bull: The Science of Food Fraud Forensics,44.74,In stock,../media/cache/68/ca/68caaf9ac41964d5167a3eb67c638393.jpg,Four
Someone Like You (The Harrisons #2),52.79,In stock,../media/cache/e3/d0/e3d05227f3fc24f0e0c84ccebe108fb0.jpg,Five
"So Cute It Hurts!!, Vol. 6 (So Cute It Hurts!! #6)",35.43,In stock,../media/cache/b2/48/b2484d13793ff1c4271a3d4023d4d24e.jpg,Four
Shtum,55.84,In stock,../media/cache/03/16/0316bb6f4785ac69c0643109201bad5d.jpg,Four
See America: A Celebration of Our National Parks & Treasured Sites,48.87,In stock,../media/cache/9a/7e/9a7e63f12829df4b43b31d110bf3dc2e.jpg,Three
salt.,46.78,In stock,../media/cache/3f/41/3f4160ada0b16e3c64cd2d0dffe781c8.jpg,Four
Robin War,47.82,In stock,../media/cache/45/1d/451d3543022242b8b245793e6b5c26bb.jpg,Three
"Red Hood/Arsenal, Vol. 1: Open for Business (Red Hood/Arsenal #1)",25.48,In stock,../media/cache/da/78/da78757466c3b0a2c89f0ddf6b5e642f.jpg,Two
Rain Fish,23.57,In stock,../media/cache/bb/e2/bbe26db72b8a32117bfe4981b7cc8147.jpg,Three
"Quarter Life Poetry: Poems for the Young, Broke and Hangry",50.89,In stock,../media/cache/c8/f2/c8f297fab080ddd02b3ed5c17b83af85.jpg,Five
Pet Sematary,10.56,In stock,../media/cache/7a/72/7a72465b21dbf998323e37b31f9a3f4a.jpg,Three
"Overload: How to Unplug, Unwind, and Unleash Yourself from the Pressure of Stress",52.15,In stock,../media/cache/9c/da/9cda4893c7fce0c1c8eaa34fb092aa04.jpg,Three
Once Was a Time,18.28,In stock,../media/cache/97/12/971212afa8e4ff49d92f678bc889d8b7.jpg,Two
Old School (Diary of a Wimpy Kid #10),11.83,In stock,../media/cache/df/5d/df5d172abe87deda6d533e3e908d27d8.jpg,Five
No Dream Is Too High: Life Lessons From a Man Who Walked on the Moon,21.95,In stock,../media/cache/b5/6f/b56ff04effb66fe701a22abd4a7f1667.jpg,Two
"Naruto (3-in-1 Edition), Vol. 14: Includes Vols. 40, 41 & 42 (Naruto: Omnibus #14)",38.39,In stock,../media/cache/c8/22/c822360ce0f91c40f7a0491c22287646.jpg,Two
My Name Is Lucy Barton,41.56,In stock,../media/cache/ca/b1/cab150e556b5fab663a9fec00ed97943.jpg,One
My Mrs. Brown,24.48,In stock,../media/cache/e0/79/e07906c1e507055da9a2260a74f58273.jpg,Three
My Kind of Crazy,40.36,In stock,../media/cache/46/6e/466e9636819aad1126ac6cefb5313ba8.jpg,One
Mr. Mercedes (Bill Hodges Trilogy #1),28.9,In stock,../media/cache/a7/f0/a7f092a7b79f848df0226f808fed489b.jpg,One
More Than Music (Chasing the Dream #1),37.61,In stock,../media/cache/3f/e7/3fe7073a5caac81929524d2d9488f928.jpg,Two
Made to Stick: Why Some Ideas Survive and Others Die,38.85,In stock,../media/cache/e2/2e/e22e4a82d97f9f0689d5295a98f5dcff.jpg,Five
Luis Paints the World,53.95,In stock,../media/cache/85/e7/85e75d5a9309da5807c82decf3d90263.jpg,Three
Luckiest Girl Alive,49.83,In stock,../media/cache/81/c0/81c0a1ce03db82568e2496db945a8227.jpg,Three
Lowriders to the Center of the Earth (Lowriders in Space #2),51.51,In stock,../media/cache/b2/97/b2978e96069dd91785e5ab0bc99c022e.jpg,Two
Love Is a Mix Tape (Music #1),18.03,In stock,../media/cache/a2/6d/a26d8449abb3381e09126eda5f4e8151.jpg,One
Looking for Lovely: Collecting the Moments that Matter,29.14,In stock,../media/cache/61/1e/611e1804ad968e309a5f788d4ebc1cb4.jpg,Five
"Living Leadership by Insight: A Good Leader Achieves, a Great Leader Builds Monuments",46.91,In stock,../media/cache/e9/5e/e95e82f09681709bb0f927341dda274e.jpg,Four
Let It Out: A Journey Through Journaling,26.79,In stock,../media/cache/51/fc/51fcd3e9384894e6a53a753d2ab856ee.jpg,Five
Lady Midnight (The Dark Artifices #1),16.28,In stock,../media/cache/89/a6/89a61d48e93bc92537c0a2cb2c0094bb.jpg,Five
"It's All Easy: Healthy, Delicious Weeknight Meals in under 30 Minutes",19.55,In stock,../media/cache/fe/67/fe67c381d6a0c4c00a7c191d16939554.jpg,One
Island of Dragons (Unwanteds #7),29.65,In stock,../media/cache/75/b9/75b99691594fde72ccb1831624cfeff6.jpg,One
I Know What I'm Doing -- and Other Lies I Tell Myself: Dispatches from a Life Under Construction,25.98,In stock,../media/cache/ea/7b/ea7bcac4b27a5bf6d4f8125bb7af3361.jpg,Four
I Am Pilgrim (Pilgrim #1),10.6,In stock,../media/cache/ed/07/ed07c9e7c53d4f33a6eb7d41eb0e6d4a.jpg,Four
"Hyperbole and a Half: Unfortunate Situations, Flawed Coping Mechanisms, Mayhem, and Other Things That Happened",14.75,In stock,../media/cache/b5/a9/b5a90d1c36a96513942f006345ace3d2.jpg,Five
"Hush, Hush (Hush, Hush #1)",47.02,In stock,../media/cache/2a/b9/2ab91479fe480e964f319fa8ac6991b2.jpg,Three
Hold Your Breath (Search and Rescue #1),28.82,In stock,../media/cache/0b/89/0b89c3b317d0f89da48356a0b5959c1e.jpg,One
Hamilton: The Revolution,58.79,In stock,../media/cache/34/ef/34ef0844cb1fbca6ab73444087fcf0e6.jpg,Three
Greek Mythic History,10.23,In stock,../media/cache/36/cf/36cf56c7bdf35aadbcc6f05a8e8d8fcb.jpg,Five
God: The Most Unpleasant Character in All Fiction,30.03,In stock,../media/cache/1f/db/1fdb125bcb8cee71f3404b4dc293348c.jpg,Five
Glory over Everything: Beyond The Kitchen House,45.84,In stock,../media/cache/96/41/964194a317f8ce5ed031bf4c9ceb43ab.jpg,Three
Feathers: Displays of Brilliant Plumage,49.05,In stock,../media/cache/f2/ee/f2ee668cf593ff13a9560c2801e9c2a2.jpg,Three
"Far & Away: Places on the Brink of Change: Seven Continents, Twenty-Five Years",15.06,In stock,../media/cache/11/e2/11e227bdb5fe8b43dcc2366a157a47c2.jpg,Four
Every Last Word,46.47,In stock,../media/cache/92/e7/92e7f0a8ca38964fea93e911aefbf6c9.jpg,Three
Eligible (The Austen Project #4),27.09,In stock,../media/cache/26/3b/263bf5d128bf18553ea8da8bb19e9a0c.jpg,Three
El Deafo,57.62,In stock,../media/cache/34/eb/34eb0f1b570d4f1f6ad106652f1ac6ff.jpg,Five
Eight Hundred Grapes,14.39,In stock,../media/cache/8c/01/8c011092f05791961d25ec3cfcf0a832.jpg,Four
"Eaternity: More than 150 Deliciously Easy Vegan Recipes for a Long, Healthy, Satisfied, Joyful Life",51.75,In stock,../media/cache/b1/e1/b1e15eef42c0d71596f9f9ad4e9f48b0.jpg,Five
"Eat Fat, Get Thin",54.07,In stock,../media/cache/62/3f/623f8e7f7432ce744f4318aae8166ce4.jpg,Two
Don't Get Caught,55.35,In stock,../media/cache/b2/df/b2df2ea409c5cf28538b67aff424b11f.jpg,One
Doctor Sleep (The Shining #2),40.12,In stock,../media/cache/55/bf/55bfc858c1cb19867e41415532ae43c6.jpg,Two
Demigods & Magicians: Percy and Annabeth Meet the Kanes (Percy Jackson & Kane Chronicles Crossover #1-3),37.51,In stock,../media/cache/8f/80/8f8074d9f035c2a0ef8595ad89f7bcc8.jpg,Five
Dear Mr. Knightley,11.21,In stock,../media/cache/78/87/78873811f8c1d75a0c26d8cc8e6a9dbc.jpg,Five
Daily Fantasy Sports,36.58,In stock,../media/cache/44/ff/44ff81a2ea37d3946605e205ddd538eb.jpg,One
Crazy Love: Overwhelmed by a Relentless God,47.72,In stock,../media/cache/03/f1/03f1e337afadba35687672b5625a9757.jpg,Two
Cometh the Hour (The Clifton Chronicles #6),25.01,In stock,../media/cache/55/11/5511a4296fbd484dcaa89c8a2d25965d.jpg,Three
Code Name Verity (Code Name Verity #1),22.13,In stock,../media/cache/f5/58/f55886d1bf600529a35e1bd932c78ca0.jpg,Four
Clockwork Angel (The Infernal Devices #1),44.14,In stock,../media/cache/ff/0e/ff0ee0002f510112b6d7a88f53366e1d.jpg,One
City of Glass (The Mortal Instruments #3),56.02,In stock,../media/cache/00/08/0008e65aa431ed3625ad3a4352f8e90d.jpg,Four
City of Fallen Angels (The Mortal Instruments #4),11.23,In stock,../media/cache/c9/40/c940b6c329ecc39aaed2ab0140592a4b.jpg,Four
City of Bones (The Mortal Instruments #1),43.28,In stock,../media/cache/96/af/96af4aaf25ab49b057c10b5b7eb7652c.jpg,One
City of Ashes (The Mortal Instruments #2),47.27,In stock,../media/cache/68/da/68dab382d535305ca6025be9921df0d1.jpg,One
Cell,20.29,In stock,../media/cache/0b/97/0b97282ed82b771ed328e05386a84adb.jpg,Four
Catching Jordan (Hundred Oaks),50.83,In stock,../media/cache/ad/ac/adac97366586d261feab30bf5220756e.jpg,Three
"Carry On, Warrior: Thoughts on Life Unarmed",31.85,In stock,../media/cache/dd/f5/ddf5da673bb34a74a81faf7271c7ca13.jpg,Three
Carrie,46.23,In stock,../media/cache/c5/6f/c56f37eb53888765eb55f86fb7381c2f.jpg,Two
Buying In: The Secret Dialogue Between What We Buy and Who We Are,37.8,In stock,../media/cache/f2/fa/f2faa289117546efa0b4068a07778ab0.jpg,Four
Brain on Fire: My Month of Madness,49.32,In stock,../media/cache/88/aa/88aad1204951e0900906173b086e6695.jpg,Five
Batman: Europa,32.01,In stock,../media/cache/f1/fe/f1fecf0ce9b5771e4d2c9619e8550988.jpg,Two
Barefoot Contessa Back to Basics,28.01,In stock,../media/cache/b8/38/b838b65e0e1ac3a9b498dfb1bf004420.jpg,One
Barefoot Contessa at Home: Everyday Recipes You'll Make Over and Over Again,50.62,In stock,../media/cache/74/aa/74aa29b1ba4147eaf5b46671bf235861.jpg,Five
Balloon Animals,17.03,In stock,../media/cache/6e/23/6e2324cae6335e8e98c8b46597afc9a3.jpg,Three
Art Ops Vol. 1,48.8,In stock,../media/cache/0b/b4/0bb4c64f1522c033368df5567a349472.jpg,Three
Aristotle and Dante Discover the Secrets of the Universe (Aristotle and Dante Discover the Secrets of the Universe #1),58.14,In stock,../media/cache/61/1a/611aba0ef5b859ba1977ef30677b0194.jpg,Four
Angels Walking (Angels Walking #1),34.2,In stock,../media/cache/50/0e/500eeb810e940424827580574e46852c.jpg,Two
Angels & Demons (Robert Langdon #1),51.48,In stock,../media/cache/b4/2a/b42a187c37de904f776070c57f51c756.jpg,Three
All the Light We Cannot See,29.87,In stock,../media/cache/41/c3/41c37f7f0e03ee1144dd6fa89483b5d9.jpg,Five
"Adulthood Is a Myth: A ""Sarah's Scribbles"" Collection",10.9,In stock,../media/cache/a2/b9/a2b974e5a66e7502c77d2e4632abe033.jpg,Two
Abstract City,56.37,In stock,../media/cache/e7/70/e77019ebd71bcf6badb085bddf47c413.jpg,Five
A Time of Torment (Charlie Parker #14),48.35,In stock,../media/cache/e8/c0/e8c0ba15066bab950ae161fd60949b9a.jpg,Five
A Study in Scarlet (Sherlock Holmes #1),16.73,In stock,../media/cache/8f/a4/8fa41d6caa10e427356b8a590eb4d96b.jpg,Two
"A Series of Catastrophes and Miracles: A True Story of Love, Science, and Cancer",56.48,In stock,../media/cache/9b/20/9b2076ce7414103a093ce2459d089969.jpg,Two
A People's History of the United States,40.79,In stock,../media/cache/75/20/75200336c141156746000f7055df344a.jpg,Two
A Man Called Ove,39.72,In stock,../media/cache/9c/f1/9cf1f4a47b8d08909fc092e6ae598d83.jpg,One
A Distant Mirror: The Calamitous 14th Century,14.58,In stock,../media/cache/41/d5/41d5fa6a81cdbcbe6b0b15757a4c9144.jpg,Three
A Brush of Wings (Angels Walking #3),55.51,In stock,../media/cache/4d/16/4d163d43cb4aa624e599330a39abace5.jpg,One
1491: New Revelations of the Americas Before Columbus,21.8,In stock,../media/cache/88/75/8875f384ce9103281b7f6e86a2b8204d.jpg,Three
"The Three Searches, Meaning, and the Story",13.33,In stock,../media/cache/83/35/8335b71599b5a257a56cfabdd79080a4.jpg,Three
Searching for Meaning in Gailana,38.73,In stock,../media/cache/3b/04/3b045fe0394dc192950a0ec9e3812fe4.jpg,One
Rook,37.86,In stock,../media/cache/55/33/5533595a623c3bb947c4a5171fc2df08.jpg,Four
My Kitchen Year: 136 Recipes That Saved My Life,11.53,In stock,../media/cache/76/a1/76a1516c8d9c3e620626f30840013a85.jpg,Two
13 Hours: The Inside Account of What Really Happened In Benghazi,27.06,In stock,../media/cache/15/f7/15f78e0b04feb9b94e88865803cb5e9e.jpg,One
Will You Won't You Want Me?,13.86,In stock,../media/cache/16/e3/16e3ca741956485119251e7442a67e2e.jpg,Three
Tipping Point for Planet Earth: How Close Are We to the Edge?,37.55,In stock,../media/cache/56/97/5697f2f8f628129df01c5790985ffd9b.jpg,One
The Star-Touched Queen,32.3,In stock,../media/cache/d3/0d/d30dd8b6be6f9fcfd17178e8083238b6.jpg,Five
The Silent Sister (Riley MacPherson #1),46.29,In stock,../media/cache/30/2c/302cd9c84442e139145ec0993880d7e0.jpg,Five
The Midnight Watch: A Novel of the Titanic and the Californian,26.2,In stock,../media/cache/97/3a/973a2c3462a18fc90d3b9662d959df37.jpg,One
The Lonely City: Adventures in the Art of Being Alone,33.26,In stock,../media/cache/5c/5e/5c5e527fea6b17199773bb175b515aee.jpg,Two
The Gray Rhino: How to Recognize and Act on the Obvious Dangers We Ignore,59.15,In stock,../media/cache/9f/25/9f255826f354776dda9afbd5576a7add.jpg,Four
The Golden Condom: And Other Essays on Love Lost and Found,39.43,In stock,../media/cache/dc/4d/dc4d070e33813a07a4e02f069e6d482f.jpg,One
The Epidemic (The Program 0.6),14.44,In stock,../media/cache/87/cd/87cd652c35e2a78535c83becae33cff2.jpg,Five
The Dinner Party,56.54,In stock,../media/cache/ba/76/ba761d23c5c0e5a0638e04739c69c5d0.jpg,Two
The Diary of a Young Girl,59.9,In stock,../media/cache/83/d5/83d5526864a108d27fd4b03dd31ec18b.jpg,Three
The Children,11.88,In stock,../media/cache/d8/03/d803ab341d3020a3bb280d6135e4ae65.jpg,Three
Stars Above (The Lunar Chronicles #4.5),48.05,In stock,../media/cache/fd/5b/fd5b14399052ab552e240ed18ab03c6d.jpg,Two
Snatched: How A Drug Queen Went Undercover for the DEA and Was Kidnapped By Colombian Guerillas,21.21,In stock,../media/cache/2a/f3/2af39796852729270fb23e05a662a42c.jpg,Three
Raspberry Pi Electronics Projects for the Evil Genius,49.67,In stock,../media/cache/a2/da/a2da8957b9cb8265d7f1dfeb0651f1c7.jpg,Four
Quench Your Own Thirst: Business Lessons Learned Over a Beer or Two,43.14,In stock,../media/cache/2d/fd/2dfdc52bcdbd82dee50372bc46c83e15.jpg,One
Psycho: Sanitarium (Psycho #1.5),36.97,In stock,../media/cache/02/5c/025c30a378e2a4190e84f1429e81b803.jpg,Five
Poisonous (Max Revere Novels #3),26.8,In stock,../media/cache/23/52/2352718971d5e166fa9541a5a7d716fa.jpg,Three
One with You (Crossfire #5),15.71,In stock,../media/cache/b8/29/b829181ae95c8f020c1ad3273192de30.jpg,Four
No Love Allowed (Dodge Cove #1),54.65,In stock,../media/cache/70/3e/703e053877204a396ec6e7beac863118.jpg,Four
Murder at the 42nd Street Library (Raymond Ambler #1),54.36,In stock,../media/cache/c3/8d/c38d65cd155b67ca025f0655bd1bb095.jpg,Four
Most Wanted,35.28,In stock,../media/cache/8b/bc/8bbc5ab4c3784b4d9b93eb0fd1fb6fd6.jpg,Three
"Love, Lies and Spies",20.55,In stock,../media/cache/7a/22/7a224a6e174af91950e9b124afe54e0e.jpg,Two
How to Speak Golf: An Illustrated Guide to Links Lingo,58.32,In stock,../media/cache/d2/64/d264ad1af882ce391005dc7215ac90e7.jpg,Five
Hide Away (Eve Duncan #20),11.84,In stock,../media/cache/57/07/5707c3d5d4fd44d943d51730ba7d429a.jpg,One
Furiously Happy: A Funny Book About Horrible Things,41.46,In stock,../media/cache/ab/2a/ab2ae4f02aa46271b4bfc77494039fc6.jpg,Four
Everyday Italian: 125 Simple and Delicious Recipes,20.1,In stock,../media/cache/5a/64/5a6499d41ccaad4c4f7eeaa90e16345a.jpg,Five
Equal Is Unfair: America's Misguided Fight Against Income Inequality,56.86,In stock,../media/cache/00/11/001153d2a22d889837efac1703e10a5e.jpg,One
Eleanor & Park,56.51,In stock,../media/cache/ed/d7/edd781d3c9d63a395f80f241445e88fa.jpg,Five
Dirty (Dive Bar #1),40.83,In stock,../media/cache/ae/90/ae903f6f6d059954be4e85497dd76bf5.jpg,Four
Can You Keep a Secret? (Fear Street Relaunch #4),48.64,In stock,../media/cache/0b/2f/0b2f432cc27132f688fcdf29618521e0.jpg,One
Boar Island (Anna Pigeon #19),59.48,In stock,../media/cache/d5/81/d58157866ea8f015a8e4c55b23b8c96f.jpg,Three
A Paris Apartment,39.01,In stock,../media/cache/16/57/16575316618bd7e922d5b0e0f87de2ca.jpg,Four
"A la Mode: 120 Recipes in 60 Pairings: Pies, Tarts, Cakes, Crisps, and More Topped with Ice Cream, Gelato, Frozen Custard, and More",38.77,In stock,../media/cache/98/19/9819ff3a8290dc6ab8797d00de5ec554.jpg,One
Troublemaker: Surviving Hollywood and Scientology,48.39,In stock,../media/cache/77/82/778285b3c87d6d5d98003aa0f2f65933.jpg,Two
The Widow,27.26,In stock,../media/cache/fd/71/fd71fb07247bf911505a351c0670c6dc.jpg,Two
"The Sleep Revolution: Transforming Your Life, One Night at a Time",11.68,In stock,../media/cache/3d/c5/3dc5455313710cf7055c060114e25bf0.jpg,Four
The Improbability of Love,59.45,In stock,../media/cache/06/49/06493269f6893cfd24b650f66df51882.jpg,One
The Art of Startup Fundraising,21.0,In stock,../media/cache/b3/7b/b37be83183f1dcb759d92bda8f8998a4.jpg,Three
Take Me Home Tonight (Rock Star Romance #3),53.98,In stock,../media/cache/a6/4b/a64b3c559f59748bfdbbe75be3e16075.jpg,Three
Sleeping Giants (Themis Files #1),48.74,In stock,../media/cache/c0/72/c072c1ef144d571abd25fe9cc18cceba.jpg,One
"Setting the World on Fire: The Brief, Astonishing Life of St. Catherine of Siena",21.15,In stock,../media/cache/8b/c4/8bc43a6b42d0283ab4bf611f1b497126.jpg,Two
Playing with Fire,13.71,In stock,../media/cache/90/0b/900bd2e60d56b6480a4e8eb2dddb46d6.jpg,Three
Off the Hook (Fishing for Trouble #1),47.67,In stock,../media/cache/1d/78/1d78fe226e1adb9cb591fa21f8a9bf68.jpg,Three
Mothering Sunday,13.34,In stock,../media/cache/a8/84/a8843a3fe1a40d5c7df60bbb8cd76ecd.jpg,Two
"Mother, Can You Not?",16.89,In stock,../media/cache/ae/03/ae03f5d4d4c2ee038ac4c4ce9b71e592.jpg,Five
M Train,27.18,In stock,../media/cache/d6/e8/d6e8258cee98f80727e99f7ac5aa1b88.jpg,One
Lilac Girls,17.28,In stock,../media/cache/6c/2e/6c2e764e3ea89859b52df8de4f12af7a.jpg,Two
Lies and Other Acts of Love,45.14,In stock,../media/cache/29/88/2988f5fb3dfd95214dba2ecb2d496c94.jpg,One
Lab Girl,40.85,In stock,../media/cache/e9/72/e972f8b4abaaa6f8f449479cd9d87be3.jpg,One
Keep Me Posted,20.46,In stock,../media/cache/ae/ac/aeac003461b89c7ef826251d940b2afc.jpg,Four
It Didn't Start with You: How Inherited Family Trauma Shapes Who We Are and How to End the Cycle,56.27,In stock,../media/cache/ee/a9/eea9e831f8964b4dc0190c84a1f9a1f6.jpg,Three
Grey (Fifty Shades #4),48.49,In stock,../media/cache/bb/ee/bbeeab4c4ce572c0e9764e3a96c6d4a5.jpg,Four
"Exit, Pursued by a Bear",51.34,In stock,../media/cache/ca/99/ca99bafb2a75d4fadb8d64efed26316f.jpg,Four
Daredevils,16.34,In stock,../media/cache/31/71/31715c5e3b53bf1e2f41e394f024a8c4.jpg,Three
Cravings: Recipes for What You Want to Eat,20.5,In stock,../media/cache/ae/5c/ae5ca435fb095e374d2c2aa9f7b6f380.jpg,Three
Born for This: How to Find the Work You Were Meant to Do,21.59,In stock,../media/cache/aa/67/aa677a97ecdcbbde7471f1c90ed0cf6f.jpg,Five
Arena,21.36,In stock,../media/cache/51/88/518810d182843244a404f2a2a614a93b.jpg,Four
Adultery,20.88,In stock,../media/cache/79/d9/79d99cfa5557be0643ba00bfcd35256b.jpg,Five
A Mother's Reckoning: Living in the Aftermath of Tragedy,19.53,In stock,../media/cache/28/58/285861a80930ffa7521dcb8bd19656e9.jpg,Three
A Gentleman's Position (Society of Gentlemen #3),14.75,In stock,../media/cache/f0/e0/f0e0db3edcb14293a52b51929cc72979.jpg,Five
11/22/63,48.48,In stock,../media/cache/f6/c5/f6c5d27eacb123238f28a32263694d74.jpg,Three
"10% Happier: How I Tamed the Voice in My Head, Reduced Stress Without Losing My Edge, and Found Self-Help That Actually Works",24.57,In stock,../media/cache/40/b2/40b246cf12df5345dc0371c040fddb4b.jpg,Two
10-Day Green Smoothie Cleanse: Lose Up to 15 Pounds in 10 Days!,49.71,In stock,../media/cache/23/c2/23c2108ae81327c7f3fb0721976cba5e.jpg,Five
Without Shame,48.27,In stock,../media/cache/90/86/9086ca3d1d5c4059beb7dcf762926e1e.jpg,Five
Watchmen,58.05,In stock,../media/cache/0b/43/0b43137f35134bf211608d1e7197b086.jpg,Four
Unlimited Intuition Now,58.87,In stock,../media/cache/61/46/6146f9ffb87a4f82301d033aa74cc48b.jpg,Four
Underlying Notes,11.82,In stock,../media/cache/ee/59/ee593e57a7fb110d96f1688b0fdd9d59.jpg,Two
The Shack,28.03,In stock,../media/cache/20/8b/208b77faac57115ae239391fe2a64c86.jpg,One
The New Brand You: Your New Image Makes the Sale for You,44.05,In stock,../media/cache/9b/33/9b33c7a5431415614f7b788e0c1552c9.jpg,Five
"The Moosewood Cookbook: Recipes from Moosewood Restaurant, Ithaca, New York",12.34,In stock,../media/cache/d4/53/d453cfb6c08dbf76d200ffa858bc9979.jpg,Four
The Flowers Lied,16.68,In stock,../media/cache/a9/f0/a9f00f8505431e64db0f91df762a6d73.jpg,Two
"The Fabric of the Cosmos: Space, Time, and the Texture of Reality",55.91,In stock,../media/cache/5e/7f/5e7f7d9913d4c95d33904770c518d537.jpg,One
The Book of Mormon,24.57,In stock,../media/cache/83/db/83dbf86eb0fed1d99de2148eac4eb064.jpg,Three
The Art and Science of Low Carbohydrate Living,52.98,In stock,../media/cache/4b/d4/4bd43108fb070ad8ebba9cdb00b14069.jpg,Five
