title,price,stock,image,category
A Light in the Attic,51.77,In stock,../media/cache/2c/da/2cdad67c44b002e7ead0cc35693c0e8b.jpg,Three
Tipping the Velvet,53.74,In stock,../media/cache/26/0c/260c6ae16bce31c8f8c95daddd9f4a1c.jpg,One
Soumission,50.1,In stock,../media/cache/3e/ef/3eef99c9d9adef34639f510662022830.jpg,One
Sharp Objects,47.82,In stock,../media/cache/32/51/3251cf3a3412f53f339e42cac2134093.jpg,Four
Sapiens: A Brief History of Humankind,54.23,In stock,../media/cache/be/a5/bea5697f2534a2f86a3ef27b5a8c12a6.jpg,Five
The Requiem Red,22.65,In stock,../media/cache/68/33/68339b4c9bc034267e1da611ab3b34f8.jpg,One
The Dirty Little Secrets of Getting Your Dream Job,33.34,In stock,../media/cache/92/27/92274a95b7c251fea59a2b8a78275ab4.jpg,Four
"The Coming Woman: A Novel Based on the Life of the Infamous Feminist, Victoria Woodhull",17.93,In stock,../media/cache/3d/54/3d54940e57e662c4dd1f3ff00c78cc64.jpg,Three
The Boys in the Boat: Nine Americans and Their Epic Quest for Gold at the 1936 Berlin Olympics,22.6,In stock,../media/cache/66/88/66883b91f6804b2323c8369331cb7dd1.jpg,Four
The Black Maria,52.15,In stock,../media/cache/58/46/5846057e28022268153beff6d352b06c.jpg,One
"Starving Hearts (Triangular Trade Trilogy, #1)",13.99,In stock,../media/cache/be/f4/bef44da28c98f905a3ebec0b87be8530.jpg,Two
Shakespeare's Sonnets,20.66,In stock,../media/cache/10/48/1048f63d3b5061cd2f424d20b3f9b666.jpg,Four
Set Me Free,17.46,In stock,../media/cache/5b/88/5b88c52633f53cacf162c15f4f823153.jpg,Five
Scott Pilgrim's Precious Little Life (Scott Pilgrim #1),52.29,In stock,../media/cache/94/b1/94b1b8b244bce9677c2f29ccc890d4d2.jpg,Five
Rip it Up and Start Again,35.02,In stock,../media/cache/81/c4/81c4a973364e17d01f217e1188253d5e.jpg,Five
"Our Band Could Be Your Life: Scenes from the American Indie Underground, 1981-1991",57.25,In stock,../media/cache/54/60/54607fe8945897cdcced0044103b10b6.jpg,Three
Olio,23.88,In stock,../media/cache/55/33/553310a7162dfbc2c6d19a84da0df9e1.jpg,One
Mesaerion: The Best Science Fiction Stories 1800-1849,37.59,In stock,../media/cache/09/a3/09a3aef48557576e1a85ba7efea8ecb7.jpg,One
Libertarianism for Beginners,51.33,In stock,../media/cache/0b/bc/0bbcd0a6f4bcd81ccb1049a52736406e.jpg,Two
It's Only the Himalayas,45.17,In stock,../media/cache/27/a5/27a53d0bb95bdd88288eaf66c9230d7e.jpg,Two
In Her Wake,12.84,In stock,../media/cache/5d/72/5d72709c6a7a9584a4d1cf07648bfce1.jpg,One
How Music Works,37.32,In stock,../media/cache/5c/c8/5cc8e107246cb478960d4f0aba1e1c8e.jpg,Two
"Foolproof Preserving: A Guide to Small Batch Jams, Jellies, Pickles, Condiments, and More: A Foolproof Guide to Making Small Batch Jams, Jellies, Pickles, Condiments, and More",30.52,In stock,../media/cache/9f/59/9f59f01fa916a7bb8f0b28a4012179a4.jpg,Three
Chase Me (Paris Nights #2),25.27,In stock,../media/cache/9c/2e/9c2e0eb8866b8e3f3b768994fd3d1c1a.jpg,Five
Black Dust,34.53,In stock,../media/cache/44/cc/44ccc99c8f82c33d4f9d2afa4ef25787.jpg,Five
Birdsong: A Story in Pictures,54.64,In stock,../media/cache/af/6e/af6e796160fe63e0cf19d44395c7ddf2.jpg,Three
America's Cradle of Quarterbacks: Western Pennsylvania's Football Factory from Johnny Unitas to Joe Montana,22.5,In stock,../media/cache/ef/0b/ef0bed08de4e083dba5e20fdb98d9c36.jpg,Three
Aladdin and His Wonderful Lamp,53.13,In stock,../media/cache/d6/da/d6da0371958068bbaf39ea9c174275cd.jpg,Three
Worlds Elsewhere: Journeys Around Shakespeare’s Globe,40.3,In stock,../media/cache/2e/98/2e98c332bf8563b584784971541c4445.jpg,Five
Wall and Piece,44.18,In stock,../media/cache/a5/41/a5416b9646aaa7287baa287ec2590270.jpg,Four
The Four Agreements: A Practical Guide to Personal Freedom,17.66,In stock,../media/cache/0f/7e/0f7ee69495c0df1d35723f012624a9f8.jpg,Five
The Five Love Languages: How to Express Heartfelt Commitment to Your Mate,31.05,In stock,../media/cache/38/c5/38c56fba316c07305643a8065269594e.jpg,Three
The Elephant Tree,23.82,In stock,../media/cache/5d/7e/5d7ecde8e81513eba8a64c9fe000744b.jpg,Five
The Bear and the Piano,36.89,In stock,../media/cache/cf/bb/cfbb5e62715c6d888fd07794c9bab5d6.jpg,One
Sophie's World,15.94,In stock,../media/cache/65/71/6571919836ec51ed54f0050c31d8a0cd.jpg,Five
Penny Maybe,33.29,In stock,../media/cache/12/53/1253c21c5ef3c6d075c5fa3f5fecee6a.jpg,Three
Maude (1883-1993):She Grew Up with the country,18.02,In stock,../media/cache/f5/88/f5889d038f5d8e949b494d147c2dcf54.jpg,Two
"In a Dark, Dark Wood",19.63,In stock,../media/cache/23/85/238570a1c284e730dbc737a7e631ae2b.jpg,One
Behind Closed Doors,52.22,In stock,../media/cache/e1/5c/e15c289ba58cea38519e1281e859f0c1.jpg,Four
You can't bury them all: Poems,33.63,In stock,../media/cache/e9/20/e9203b733126c4a0832a1c7885dc27cf.jpg,Two
Slow States of Collapse: Poems,57.31,In stock,../media/cache/72/41/72417db983862010ef0c1a25de98c7d7.jpg,Three
Reasons to Stay Alive,26.41,In stock,../media/cache/cb/bd/cbbdb0222ee8a0f6ab61657412a15794.jpg,Two
Private Paris (Private #10),47.61,In stock,../media/cache/9d/05/9d0533bae1578846d728a82913b95c26.jpg,Five
#HigherSelfie: Wake Up Your Life. Free Your Soul. Find Your Tribe.,23.11,In stock,../media/cache/9c/46/9c463c7631c82401160fd3b554b8f0e1.jpg,Five
Without Borders (Wanderlove #1),45.07,In stock,../media/cache/24/e2/24e2f5c9d325c4004d8190c054da86dd.jpg,Two
When We Collided,31.77,In stock,../media/cache/08/04/08044269fc197645268a6197c57e6173.jpg,One
"We Love You, Charlie Freeman",50.27,In stock,../media/cache/5f/15/5f152afdbc42356ecba02f61058a7e5b.jpg,Five
Untitled Collection: Sabbath Poems 2014,14.27,In stock,../media/cache/f9/3b/f93b4a650f03a5d21f2436d7813f42c2.jpg,Four
"Unseen City: The Majesty of Pigeons, the Discreet Charm of Snails & Other Wonders of the Urban Wilderness",44.18,In stock,../media/cache/41/a2/41a20f35adf0caea24f208dc01ad7681.jpg,Four
Unicorn Tracks,18.78,In stock,../media/cache/76/8e/768ea5924ac1ef6297c2be9959c796c2.jpg,Three
"Unbound: How Eight Technologies Made Us Human, Transformed Society, and Brought Our World to the Brink",25.52,In stock,../media/cache/4a/3b/4a3b055f9e378a95fedbef55e7bab7ce.jpg,One
Tsubasa: WoRLD CHRoNiCLE 2 (Tsubasa WoRLD CHRoNiCLE #2),16.28,In stock,../media/cache/36/df/36df4caaf1420b1183a8235355d39e69.jpg,One
Throwing Rocks at the Google Bus: How Growth Became the Enemy of Prosperity,31.12,In stock,../media/cache/03/86/038650c9e7517b4baf2a423cd8eed38f.jpg,Three
This One Summer,19.49,In stock,../media/cache/c4/dd/c4ddd9ced89966b0602ec85e00cd5b61.jpg,Four
Thirst,17.27,In stock,../media/cache/c4/0a/c40a64f59e7487b1a80a049f6ceb2ba5.jpg,Five
The Torch Is Passed: A Harding Family Story,19.09,In stock,../media/cache/33/e5/33e507172541628acfd421503196b578.jpg,One
The Secret of Dreadwillow Carse,56.13,In stock,../media/cache/c4/a2/c4a2a1a026c67bcceb5a411c724d7d0c.jpg,One
"The Pioneer Woman Cooks: Dinnertime: Comfort Classics, Freezer Food, 16-Minute Meals, and Other Delicious Ways to Solve Supper!",56.41,In stock,../media/cache/b7/f4/b7f4843dbe062d44be1ffcfa16b2faa4.jpg,One
The Past Never Ends,56.5,In stock,../media/cache/89/b8/89b850edb01851a91f64ba114b96acb6.jpg,Four
The Natural History of Us (The Fine Art of Pretending #2),45.22,In stock,../media/cache/5d/7f/5d7f496cdf5e5962a73ecdcc1505c1d5.jpg,Three
The Nameless City (The Nameless City #1),38.16,In stock,../media/cache/f4/79/f479de5f305c2ac0512702cf7155bb74.jpg,Four
The Murder That Never Was (Forensic Instincts #5),54.11,In stock,../media/cache/dc/44/dc44f8e2aebac48ca8553814d9b021a8.jpg,Three
The Most Perfect Thing: Inside (and Outside) a Bird's Egg,42.96,In stock,../media/cache/d4/8d/d48d5122a15347e9fe2b15ad354d69bf.jpg,Four
"The Mindfulness and Acceptance Workbook for Anxiety: A Guide to Breaking Free from Anxiety, Phobias, and Worry Using Acceptance and Commitment Therapy",23.89,In stock,../media/cache/f8/6d/f86d08178e3788563ac17be5aefd29f0.jpg,Four
The Life-Changing Magic of Tidying Up: The Japanese Art of Decluttering and Organizing,16.77,In stock,../media/cache/95/64/95647d6a526bf54120b9445e124794e1.jpg,Three
"The Inefficiency Assassin: Time Management Tactics for Working Smarter, Not Longer",20.59,In stock,../media/cache/75/dc/75dce2f5949b407161f37f0af249b018.jpg,Five
The Gutsy Girl: Escapades for Your Life of Epic Adventure,37.13,In stock,../media/cache/64/15/641570cd7e7aded53c7d33d78a9629f1.jpg,One
The Electric Pencil: Drawings from Inside State Hospital No. 3,56.06,In stock,../media/cache/2e/23/2e236e23ad52aa74505f224f6552eda8.jpg,One
The Death of Humanity: and the Case for Life,58.11,In stock,../media/cache/71/df/71df730cf38c232ee58a2e407135f055.jpg,Four
"The Bulletproof Diet: Lose up to a Pound a Day, Reclaim Energy and Focus, Upgrade Your Life",49.05,In stock,../media/cache/ee/3e/ee3e219d23e73ba71c79b700f183aaed.jpg,Three
The Art Forger,40.76,In stock,../media/cache/70/fa/70fa6c0437d9c97dbeada6bd32bf9d2c.jpg,Three
The Age of Genius: The Seventeenth Century and the Birth of the Modern Mind,19.73,In stock,../media/cache/2d/4e/2d4e358712e6c9f1d3bdd78d1a16e5a8.jpg,One
The Activist's Tao Te Ching: Ancient Advice for a Modern Revolution,32.24,In stock,../media/cache/96/db/96db61bb53930c560fb4c1c62b583816.jpg,Five
Spark Joy: An Illustrated Master Class on the Art of Organizing and Tidying Up,41.83,In stock,../media/cache/f3/4f/f34ffb24cc21c9f9f52dad4fd8f3ac21.jpg,Four
Soul Reader,39.58,In stock,../media/cache/69/85/69852567cf97264a1442cbc882c84903.jpg,Two
Security,39.25,In stock,../media/cache/da/df/dadfac66a89774b46b10225362724c83.jpg,Two
"Saga, Volume 6 (Saga (Collected Editions) #6)",25.02,In stock,../media/cache/43/ae/43aee83ebb31e2122a7215e413770e5c.jpg,Three
"Saga, Volume 5 (Saga (Collected Editions) #5)",51.04,In stock,../media/cache/e1/ea/e1ea6cb36e62ae6dc7b805f68ab9a700.jpg,Two
Reskilling America: Learning to Labor in the Twenty-First Century,19.83,In stock,../media/cache/97/f8/97f8debeeaaece9603267653076e760f.jpg,Two
"Rat Queens, Vol. 3: Demons (Rat Queens (Collected Editions) #11-15)",50.4,In stock,../media/cache/f3/ef/f3efd43ae0fa85d9b325d5e8783e7af5.jpg,Three
"Princess Jellyfish 2-in-1 Omnibus, Vol. 01 (Princess Jellyfish 2-in-1 Omnibus #1)",13.61,In stock,../media/cache/78/0b/780b2c28122750c2c383846155815bf7.jpg,Five
Princess Between Worlds (Wide-Awake Princess #5),13.34,In stock,../media/cache/b7/e8/b7e84b78be3d9bb79b71156a5e5d4e42.jpg,Five
"Pop Gun War, Volume 1: Gift",18.97,In stock,../media/cache/c8/2f/c82f629a31b3f47bdb17ac14aa51076d.jpg,One
"Political Suicide: Missteps, Peccadilloes, Bad Calls, Backroom Hijinx, Sordid Pasts, Rotten Breaks, and Just Plain Dumb Mistakes in the Annals of American Politics",36.28,In stock,../media/cache/64/44/6444dacdcb9edaadbbd691524622aeb8.jpg,Two
Patience,10.16,In stock,../media/cache/01/72/01726c619a05114dca75bd840095016d.jpg,Three
"Outcast, Vol. 1: A Darkness Surrounds Him (Outcast #1)",15.44,In stock,../media/cache/cb/00/cb004189f548d75ad430d3ed19e6daa9.jpg,Four
orange: The Complete Collection 1 (orange: The Complete Collection #1),48.41,In stock,../media/cache/03/88/03886a8502ca54dbce0d91c2568ab69d.jpg,One
Online Marketing for Busy Authors: A Step-By-Step Guide,46.35,In stock,../media/cache/ea/9b/ea9b2cb8abbb317402e618445bade1e1.jpg,One
On a Midnight Clear,14.07,In stock,../media/cache/a1/14/a114d70e7babf110ba42a389078e9a45.jpg,Three
Obsidian (Lux #1),14.86,In stock,../media/cache/fc/72/fc72f158554b4b4164701e1dfa1153c7.jpg,Two
My Paris Kitchen: Recipes and Stories,33.37,In stock,../media/cache/f5/65/f565af3d9dd20a1ad72a1e7c4157387d.jpg,Two
Masks and Shadows,56.4,In stock,../media/cache/ff/e8/ffe81bf98f8386ef29e193abfb6f9c1e.jpg,Two
"Mama Tried: Traditional Italian Cooking for the Screwed, Crude, Vegan, and Tattooed",14.02,In stock,../media/cache/10/c6/10c61093002db1fec4089d8076678624.jpg,Four
"Lumberjanes, Vol. 2: Friendship to the Max (Lumberjanes #5-8)",46.91,In stock,../media/cache/d3/15/d3158e8d3546fb90cced3c1d44a92a34.jpg,Two
"Lumberjanes, Vol. 1: Beware the Kitten Holy (Lumberjanes #1-4)",45.61,In stock,../media/cache/7e/a0/7ea062007ef00107e3c16d336b41fab2.jpg,Three
Lumberjanes Vol. 3: A Terrible Plan (Lumberjanes #9-12),19.92,In stock,../media/cache/5f/b1/5fb1bf88dcfda795606745ce35be5975.jpg,Two
"Layered: Baking, Building, and Styling Spectacular Cakes",40.11,In stock,../media/cache/98/d1/98d1c979c4bac9e147a6718946578b0f.jpg,One
Judo: Seven Steps to Black Belt (an Introductory Guide for Beginners),53.9,In stock,../media/cache/5f/52/5f52b1bc6d45daab2e330c744feb0359.jpg,Two
Join,35.67,In stock,../media/cache/93/63/9363f0065fbad5689f44fcf6e203eef3.jpg,Five
In the Country We Love: My Family Divided,22.0,In stock,../media/cache/fe/ea/feeafd2ad7b3077f8e74cbb1da9e3c7d.jpg,Four
Immunity: How Elie Metchnikoff Changed the Course of Modern Medicine,57.36,In stock,../media/cache/26/1c/261c4eaf957ae4aacf2229b482e76dbe.jpg,Five
"I Hate Fairyland, Vol. 1: Madly Ever After (I Hate Fairyland (Compilations) #1-5)",29.17,In stock,../media/cache/aa/74/aa74004807e97a79aa084b5db329a99b.jpg,Two
I am a Hero Omnibus Volume 1,54.63,In stock,../media/cache/16/d4/16d443437126bf6d536a89312c1995a5.jpg,Three
How to Be Miserable: 40 Strategies You Already Use,46.03,In stock,../media/cache/da/8b/da8bc9b824dd3f446ef63e438ddbfc85.jpg,One
Her Backup Boyfriend (The Sorensen Family #1),33.97,In stock,../media/cache/1e/bb/1ebbbc3e2d3249b111033cfc40763b0b.jpg,One
"Giant Days, Vol. 2 (Giant Days #5-8)",22.11,In stock,../media/cache/90/6f/906f0168b0e155a7077625499b1737b5.jpg,Two
Forever and Forever: The Courtship of Henry Longfellow and Fanny Appleton,29.69,In stock,../media/cache/d6/58/d658a1485b130ff26ca5fb0d5975ed2e.jpg,Three
First and First (Five Boroughs #3),15.97,In stock,../media/cache/c4/d1/c4d1517cc9370e292366b6132ca9ca36.jpg,Four
Fifty Shades Darker (Fifty Shades #2),21.96,In stock,../media/cache/cc/bd/ccbdae9e29b3594301528fa2c876ec29.jpg,One
Everydata: The Misinformation Hidden in the Little Data You Consume Every Day,54.35,In stock,../media/cache/64/94/6494bf61176ca73b61255909230030be.jpg,Two
"Don't Be a Jerk: And Other Practical Advice from Dogen, Japan's Greatest Zen Master",37.97,In stock,../media/cache/95/30/953013d044aa313cc162dec414f3969a.jpg,Two
Danganronpa Volume 1,51.99,In stock,../media/cache/78/97/7897eea91c4a85aca58d925861d4afec.jpg,Four
Crown of Midnight (Throne of Glass #2),43.29,In stock,../media/cache/66/25/6625e3bbb050de3e42a0c302c0d69f1f.jpg,Three
"Codename Baboushka, Volume 1: The Conclave of Death",36.72,In stock,../media/cache/f6/88/f688a9d6a89fdf38e4e88439ee9eda69.jpg,Four
Camp Midnight,17.08,In stock,../media/cache/dd/c9/ddc95df6754df8e71bf969c088056188.jpg,Four
Call the Nurse: True Stories of a Country Nurse on a Scottish Isle,29.14,In stock,../media/cache/88/9e/889e0bac4c7c0e7178f0165b8d3b4617.jpg,Five
Burning,28.81,In stock,../media/cache/26/95/269507c7bb35d2cec9b61a03d1c28e67.jpg,Three
Bossypants,49.46,In stock,../media/cache/27/d2/27d20361745ec2f7be668b18a4da29da.jpg,Two
"Bitch Planet, Vol. 1: Extraordinary Machine (Bitch Planet (Collected Editions))",37.92,In stock,../media/cache/e4/1d/e41d34204a1fffbf825d8beb3dbf4cbc.jpg,Two
"Avatar: The Last Airbender: Smoke and Shadow, Part 3 (Smoke and Shadow #3)",28.09,In stock,../media/cache/06/18/061811c5845d0e13bc04b2a755f0830f.jpg,Two
Algorithms to Live By: The Computer Science of Human Decisions,30.81,In stock,../media/cache/23/b4/23b42e094c02d52b14b11a960d49610e.jpg,One
A World of Flavor: Your Gluten Free Passport,42.95,In stock,../media/cache/78/2e/782e315667ec50759b8603527ee33dec.jpg,One
"A Piece of Sky, a Grain of Rice: A Memoir in Four Meditations",56.76,In stock,../media/cache/08/89/088995e862aac86c88c608d763f6390e.jpg,Five
A Murder in Time,16.64,In stock,../media/cache/11/aa/11aaad48b5f15e262456ca65294084da.jpg,One
A Flight of Arrows (The Pathfinders #2),55.53,In stock,../media/cache/82/96/8296f92b70fb1dafefecda92c1d51941.jpg,Five
A Fierce and Subtle Poison,28.13,In stock,../media/cache/12/f1/12f1963957f27fa83d51f76b183ef490.jpg,Four
A Court of Thorns and Roses (A Court of Thorns and Roses #1),52.37,In stock,../media/cache/c0/88/c08816960890396213a423941af65b8f.jpg,One
(Un)Qualified: How God Uses Broken People to Do Big Things,54.0,In stock,../media/cache/cd/db/cddb3eb483ef11a088d519205b7098fb.jpg,Five
You Are What You Love: The Spiritual Power of Habit,21.87,In stock,../media/cache/6b/70/6b70f2cdb17d9ab7551240a88b9211fe.jpg,Four
"William Shakespeare's Star Wars: Verily, A New Hope (William Shakespeare's Star Wars #4)",43.3,In stock,../media/cache/02/37/0237b445efc18c5562355a5a2c40889c.jpg,Four
Tuesday Nights in 1980,21.04,In stock,../media/cache/6b/da/6bdae061cb92c32b0b83cda8dd10275d.jpg,Two
Tracing Numbers on a Train,41.6,In stock,../media/cache/06/a6/06a6cfcf89afd1601cbba1a16cda57fb.jpg,Three
Throne of Glass (Throne of Glass #1),35.07,In stock,../media/cache/32/d6/32d6aa560e8ddf2a4da1526b95d4c7ab.jpg,Three
Thomas Jefferson and the Tripoli Pirates: The Forgotten War That Changed American History,59.64,In stock,../media/cache/97/47/974709d437b08e74649b5744471bf472.jpg,One
Thirteen Reasons Why,52.72,In stock,../media/cache/8a/83/8a83b6ce350f01bab21f85e6ba539316.jpg,One
The White Cat and the Monk: A Retelling of the Poem “Pangur Bán”,58.08,In stock,../media/cache/26/32/2632a1e12f2c085fabbe022ae4cd6933.jpg,Four
The Wedding Dress,24.12,In stock,../media/cache/28/99/28992d89f4abf54fba183fc8d074adf3.jpg,One
The Vacationers,42.15,In stock,../media/cache/37/25/372578cc073efae80cf284b56040a488.jpg,Four
The Third Wave: An Entrepreneur’s Vision of the Future,12.61,In stock,../media/cache/d0/77/d077a30042df6b916bfc8d257345c69e.jpg,Five
The Stranger,17.44,In stock,../media/cache/ea/04/ea0476a6f4c318ceccf5e2f2b39f2b15.jpg,Four
The Shadow Hero (The Shadow Hero),33.14,In stock,../media/cache/1f/62/1f621dda1b302fc16d83d94b0b5ac31c.jpg,One
The Secret (The Secret #1),27.37,In stock,../media/cache/4e/0f/4e0f05ae01d8fb6bd0d3901edd06de16.jpg,Four
The Regional Office Is Under Attack!,51.36,In stock,../media/cache/f8/31/f8314c7fdaa79fb7191a583e9a852db8.jpg,Five
The Psychopath Test: A Journey Through the Madness Industry,36.0,In stock,../media/cache/34/f5/34f5f8e513c5f048241f5695e61b2483.jpg,Two
The Project,10.65,In stock,../media/cache/10/6e/106e2fc7160712edf8e2ff996dc8cd6c.jpg,One
The Power of Now: A Guide to Spiritual Enlightenment,43.54,In stock,../media/cache/03/38/0338682e76bad3216cd4c6c28b2b625a.jpg,Two
The Omnivore's Dilemma: A Natural History of Four Meals,38.21,In stock,../media/cache/14/f3/14f3d525e2a114cd71e27201a16af188.jpg,Two
The Nerdy Nummies Cookbook: Sweet Treats for the Geek in All of Us,37.34,In stock,../media/cache/61/bd/61bdfe3950643c47d70c37c4123530f3.jpg,Five
The Murder of Roger Ackroyd (Hercule Poirot #4),44.1,In stock,../media/cache/29/fe/29fe70b1b2e5a9ba61d4bd331255e19e.jpg,Four
The Mistake (Off-Campus #2),43.29,In stock,../media/cache/a5/43/a543b100a8c1861c1bf5374ca6b576fe.jpg,Three
The Matchmaker's Playbook (Wingmen Inc. #1),55.85,In stock,../media/cache/84/ac/84acb0606c96e55dc729a9d6572a08fb.jpg,One
The Love and Lemons Cookbook: An Apple-to-Zucchini Celebration of Impromptu Cooking,37.6,In stock,../media/cache/0d/1f/0d1f3f934460f5a50aaa8c366641234c.jpg,Two
The Long Shadow of Small Ghosts: Murder and Memory in an American City,10.97,In stock,../media/cache/f2/e5/f2e51dd2b26600459f8eaeb6b9eecaa7.jpg,One
The Kite Runner,41.82,In stock,../media/cache/58/9d/589d73503d9a23d224de836134fae553.jpg,Four
The House by the Lake,36.95,In stock,../media/cache/0d/cb/0dcb33d60b0e79adf8ab9842e697ea2e.jpg,One
The Glittering Court (The Glittering Court #1),44.28,In stock,../media/cache/3e/0b/3e0b16851bec08b6cbf78d5f64af9114.jpg,One
The Girl on the Train,55.02,In stock,../media/cache/25/6c/256c946dd0962095f66c6de3b15ab300.jpg,Two
The Genius of Birds,17.24,In stock,../media/cache/13/57/1357c6aa40c9e63d2f931927fbf81f3f.jpg,One
The Emerald Mystery,23.15,In stock,../media/cache/81/58/81586cd0bf8743e1f5ed80b6a0e1fabe.jpg,Two
The Cookies & Cups Cookbook: 125+ sweet & savory recipes reminding you to Always Eat Dessert First,41.25,In stock,../media/cache/54/89/54899b4584e941ceced511d81092c88a.jpg,One
The Bridge to Consciousness: I'm Writing the Bridge Between Science and Our Old and New Beliefs.,32.0,In stock,../media/cache/fe/b7/feb764b2afa54991cfdbbffdf501b333.jpg,Three
The Artist's Way: A Spiritual Path to Higher Creativity,38.49,In stock,../media/cache/0e/6d/0e6dc2484322c5b9e7854ced66fdf62d.jpg,Five
The Art of War,33.34,In stock,../media/cache/6d/71/6d71e36c8b1b9c885e1bb6c72cd8bcf8.jpg,Five
The Argonauts,10.93,In stock,../media/cache/0a/15/0a1567cd04a6582d333db71337b4e2a6.jpg,Two
The 10% Entrepreneur: Live Your Startup Dream Without Quitting Your Day Job,27.55,In stock,../media/cache/82/93/82939ca78da0b724f16ec814849514fd.jpg,Three
Suddenly in Love (Lake Haven #1),55.99,In stock,../media/cache/e9/f4/e9f4bc8cf5ffaea1504623c936e90a48.jpg,Two
Something More Than This,16.24,In stock,../media/cache/59/10/5910fbd8a95e8e9de9c660b71e0694e2.jpg,Four
Soft Apocalypse,26.12,In stock,../media/cache/f0/06/f0060c756556b855184fa32f66280961.jpg,Two
So You've Been Publicly Shamed,12.23,In stock,../media/cache/6e/d4/6ed4991d97f60db29ec7b421e61a2cf3.jpg,Two
Shoe Dog: A Memoir by the Creator of NIKE,23.99,In stock,../media/cache/19/aa/19aa1184a3565b1dae6092146018e109.jpg,Two
"Shobu Samurai, Project Aryoku (#3)",29.06,In stock,../media/cache/ae/0c/ae0ccc307568b6d7699786411f3cbcc4.jpg,Three
Secrets and Lace (Fatal Hearts #1),20.27,In stock,../media/cache/84/7c/847c06b541e2a3b2228b96d97a5fe7a6.jpg,One
Scarlett Epstein Hates It Here,43.55,In stock,../media/cache/0f/d3/0fd306891f8fd3196653022fd67d6c87.jpg,Five
Romero and Juliet: A Tragic Tale of Love and Zombies,36.94,In stock,../media/cache/12/f8/12f8002e5aab6d783e29b31aad36b5ba.jpg,One
Redeeming Love,20.47,In stock,../media/cache/21/21/2121ba78e26194d92c334fde3850f840.jpg,Five
Poses for Artists Volume 1 - Dynamic and Sitting Poses: An Essential Reference for Figure Drawing and the Human Form,41.06,In stock,../media/cache/5a/89/5a89e2dd7866dda6660fe508bc4b5249.jpg,One
Poems That Make Grown Women Cry,14.19,In stock,../media/cache/38/64/386468a8c3e6b880664bf7885bf6f726.jpg,Four
"Nightingale, Sing",38.28,In stock,../media/cache/18/08/18086e581ad354aa65f945c2b5c51350.jpg,One
Night Sky with Exit Wounds,41.05,In stock,../media/cache/25/54/2554431c797ec725eea50b3f8a83758c.jpg,One
Mrs. Houdini,30.25,In stock,../media/cache/0e/fe/0efe86960cdff718aed01a5c3f65b1c3.jpg,Five
Modern Romance,28.26,In stock,../media/cache/28/78/2878538a1039d9c4649110499a1393fb.jpg,Five
Miss Peregrine’s Home for Peculiar Children (Miss Peregrine’s Peculiar Children #1),10.76,In stock,../media/cache/01/26/01264865c12ed6d987d6f0858cd1d0ba.jpg,One
Louisa: The Extraordinary Life of Mrs. Adams,16.85,In stock,../media/cache/6f/d9/6fd92e5143cbd5bb8bcf034e5f007dde.jpg,Two
Little Red,13.47,In stock,../media/cache/80/25/8025b80a40178f2a6dd4f99ad88e0fba.jpg,Three
Library of Souls (Miss Peregrine’s Peculiar Children #3),48.56,In stock,../media/cache/f8/54/f85417465a73e33604624205ba8306cc.jpg,Five
Large Print Heart of the Pride,19.15,In stock,../media/cache/bd/e9/bde95ab9f776c911a7aa759cad60bb41.jpg,Two
I Had a Nice Time And Other Lies...: How to find love & sh*t like that,57.36,In stock,../media/cache/5f/72/5f72c8a0d5a7292e2929a354ec8a022f.jpg,Four
Hollow City (Miss Peregrine’s Peculiar Children #2),42.98,In stock,../media/cache/e2/60/e260b008b7ea7970562295b7bc64b0cb.jpg,One
Grumbles,22.16,In stock,../media/cache/d6/1b/d61b12ef0e69d49e2645537dd6a8472a.jpg,Two
Full Moon over Noah’s Ark: An Odyssey to Mount Ararat and Beyond,49.43,In stock,../media/cache/57/77/57770cac1628f4407636635f4b85e88c.jpg,Four
Frostbite (Vampire Academy #2),29.99,In stock,../media/cache/71/76/7176317f1915fa0658bb2fe400441207.jpg,Five
Follow You Home,21.36,In stock,../media/cache/a7/4b/a74b35375ce874153fd352e33bc7bac9.jpg,One
First Steps for New Christians (Print Edition),29.0,In stock,../media/cache/f1/73/f1731459b1e2f4becf2c52b8f30b8cd7.jpg,One
Finders Keepers (Bill Hodges Trilogy #2),53.53,In stock,../media/cache/6a/81/6a81103b1c01a3f6c56e5718a838a4c8.jpg,Five
"Fables, Vol. 1: Legends in Exile (Fables #1)",41.62,In stock,../media/cache/51/8c/518c184a793b751b43045637c8002eb7.jpg,Four
Eureka Trivia 6.0,54.59,In stock,../media/cache/96/17/96173470df6fc6fef4d0008e957653ce.jpg,Four
Drive: The Surprising Truth About What Motivates Us,34.95,In stock,../media/cache/8a/49/8a490347afdc10abe7c2099e466de32f.jpg,Four
Done Rubbed Out (Reightman & Bailey #1),37.72,In stock,../media/cache/08/4d/084da0199a717cb6c1eda30f98d0ea4c.jpg,Five
Doing It Over (Most Likely To #1),35.61,In stock,../media/cache/e9/25/e9250495a525eb203652ad9da85ccb8e.jpg,Three
"Deliciously Ella Every Day: Quick and Easy Recipes for Gluten-Free Snacks, Packed Lunches, and Simple Meals",42.16,In stock,../media/cache/20/f2/20f28657b49f8cb24ed2ec6448bb6df3.jpg,Three
Dark Notes,19.19,In stock,../media/cache/6e/4e/6e4e8f4f4abd94356a9be840e4681e65.jpg,Five
"Daring Greatly: How the Courage to Be Vulnerable Transforms the Way We Live, Love, Parent, and Lead",19.43,In stock,../media/cache/55/ce/55ced903becc59121d6edb47a4dcfb56.jpg,Three
Close to You,49.46,In stock,../media/cache/fa/f6/faf6d69a42f477e1da80a71f05a4dc25.jpg,Four
Chasing Heaven: What Dying Taught Me About Living,37.8,In stock,../media/cache/b7/6a/b76a73640d26b09c4a6f373b09050bed.jpg,Two
Big Magic: Creative Living Beyond Fear,30.8,In stock,../media/cache/62/ad/62ad9b4077416ddc0c4908062bca0e5e.jpg,Three
Becoming Wise: An Inquiry into the Mystery and Art of Living,27.43,In stock,../media/cache/ff/69/ff69c96b05affa03f647287e46210bf9.jpg,Two
Beauty Restored (Riley Family Legacy Novellas #3),11.11,In stock,../media/cache/51/6f/516f605a957a1f5592b81f4e06c491bb.jpg,Two
Batman: The Long Halloween (Batman),36.5,In stock,../media/cache/78/a7/78a7f184a4d6d62412861c68f1c3ad90.jpg,Two
Batman: The Dark Knight Returns (Batman),15.38,In stock,../media/cache/be/a9/bea95dbd7b2a843519c9a1dcfc433f9b.jpg,Five
Ayumi's Violin,15.48,In stock,../media/cache/fa/18/fa18c44fba20b8191f6a88e2e28092fd.jpg,Two
