title,price,stock,image,category
The Alien Club,54.4,In stock,../media/cache/93/d0/93d01bc6bce58e8efbf560e9e3dc3379.jpg,One
Suzie Snowflake: One beautiful flake (a self-esteem story),54.81,In stock,../media/cache/db/cc/dbcc9d63b73ce9058d53f36465dbe2b2.jpg,Five
Nap-a-Roo,25.08,In stock,../media/cache/27/1f/271faa1d7561473974d12803feb1f0a1.jpg,One
"NaNo What Now? Finding your editing process, revising your NaNoWriMo book and building a writing career through publishing and beyond",10.41,In stock,../media/cache/f3/b9/f3b94d63844537271e86565071e5d716.jpg,Four
Modern Day Fables,47.44,In stock,../media/cache/79/40/79405be1357e2576e7f4b307600be914.jpg,Two
If I Gave You God's Phone Number....: Searching for Spirituality in America,20.91,In stock,../media/cache/87/fe/87fe3f7f3f62c1b1b81890578c9cf294.jpg,One
"Fruits Basket, Vol. 9 (Fruits Basket #9)",33.95,In stock,../media/cache/7c/ea/7cea6ff4f6f1427739b136db35fbfad4.jpg,Four
Dress Your Family in Corduroy and Denim,43.68,In stock,../media/cache/df/14/df1418baa09e00b877be35066084c9dc.jpg,Three
Don't Forget Steven,33.23,In stock,../media/cache/e7/75/e775bf9ea6343b2ee0be5166bb445bd2.jpg,One
Chernobyl 01:23:40: The Incredible True Story of the World's Worst Nuclear Disaster,35.92,In stock,../media/cache/5e/76/5e76a5026bd17a5b484ae2a60eec0542.jpg,Two
Art and Fear: Observations on the Perils (and Rewards) of Artmaking,48.63,In stock,../media/cache/ef/80/ef80e6100214c486562a73ce76444826.jpg,Four
A Shard of Ice (The Black Symphony Saga #1),56.63,In stock,../media/cache/27/64/27649cb5da52970f4bb2fc5234a48578.jpg,Three
A Hero's Curse (The Unseen Chronicles #1),50.49,In stock,../media/cache/95/68/95685fabe00befa6dc91277cde703b55.jpg,Three
23 Degrees South: A Tropical Tale of Changing Whether...,35.79,In stock,../media/cache/29/3e/293e31894cd2c5bf2aff452b8c818b66.jpg,Two
"Zero to One: Notes on Startups, or How to Build the Future",34.06,In stock,../media/cache/f4/8e/f48ee738bc992a68d08eadcb4338a547.jpg,Three
Why Not Me?,17.76,In stock,../media/cache/31/a6/31a61c2587add91e55a85fec33e93d15.jpg,One
When Breath Becomes Air,39.36,In stock,../media/cache/39/a5/39a5f0d3280010ca400eb4f5d262b950.jpg,Two
Vagabonding: An Uncommon Guide to the Art of Long-Term World Travel,36.94,In stock,../media/cache/d5/bf/d5bf0090470b0b8ea46d9c166f7895aa.jpg,Two
The Unlikely Pilgrimage of Harold Fry (Harold Fry #1),43.62,In stock,../media/cache/06/e2/06e2e125d332e2e09a64816ff915b859.jpg,Five
The New Drawing on the Right Side of the Brain,43.02,In stock,../media/cache/6a/55/6a55ccd4bc2383f5fe915fbef8bd5a23.jpg,Three
"The Midnight Assassin: Panic, Scandal, and the Hunt for America's First Serial Killer",28.45,In stock,../media/cache/82/6c/826c590f552ce717a2972649350c8030.jpg,Four
The Martian (The Martian #1),41.39,In stock,../media/cache/72/ed/72ed6908c3fcf2bccf79013a65943849.jpg,Two
The High Mountains of Portugal,51.15,In stock,../media/cache/55/00/550091fc134bbe67f562d95a6d6313f7.jpg,One
The Grownup,35.88,In stock,../media/cache/f4/cb/f4cb1f9c7280bf1fd05fe33d2816080f.jpg,One
The E-Myth Revisited: Why Most Small Businesses Don't Work and What to Do About It,36.91,In stock,../media/cache/11/2c/112c55a6bcd401c3bd603f5ddb2e6b82.jpg,One
South of Sunshine,28.93,In stock,../media/cache/09/11/09118b974f3685483f3e4debd1f97c90.jpg,One
Smarter Faster Better: The Secrets of Being Productive in Life and Business,38.89,In stock,../media/cache/21/88/21889b1eddaec853b02a41bdd06eef54.jpg,Five
Silence in the Dark (Logan Point #4),58.33,In stock,../media/cache/bb/1c/bb1c91883579f1f99fe6ebf13b92c1c1.jpg,Three
Shadows of the Past (Logan Point #1),39.67,In stock,../media/cache/93/e0/93e0ec623673a8f83598c9aa7b6c94ec.jpg,Five
Roller Girl,14.1,In stock,../media/cache/b8/bd/b8bd3e5bc547c7c851689a844c9db429.jpg,Five
Rising Strong,21.82,In stock,../media/cache/3b/f3/3bf3c719382c03984ab9766803bed964.jpg,Three
Proofs of God: Classical Arguments from Tertullian to Barth,54.21,In stock,../media/cache/3f/ef/3fef12d9da503693af12997c0ea0897f.jpg,One
Please Kill Me: The Uncensored Oral History of Punk,31.19,In stock,../media/cache/06/f1/06f185c0be2ad6e2fe059464c03f1b47.jpg,Four
Out of Print: City Lights Spotlight No. 14,53.64,In stock,../media/cache/93/d5/93d5c64abfad9ed6a0cb2e26f19f1a1e.jpg,Five
My Life Next Door (My Life Next Door ),36.39,In stock,../media/cache/98/00/98001a78a78ab77027145ff586d64431.jpg,Five
Miller's Valley,58.54,In stock,../media/cache/dc/1a/dc1a54201eff16a11e7d84eef5ea36c7.jpg,Two
Man's Search for Meaning,29.48,In stock,../media/cache/ed/ff/edffa2eec8d96b8ddcd53d5c2eff8453.jpg,Three
"Love That Boy: What Two Presidents, Eight Road Trips, and My Son Taught Me About a Parent's Expectations",25.06,In stock,../media/cache/6d/1b/6d1b236549b8d5bc9e20786a25b7e7d1.jpg,Two
Living Forward: A Proven Plan to Stop Drifting and Get the Life You Want,12.55,In stock,../media/cache/c9/76/c9767187068d80827d0967225ce3925d.jpg,Three
Les Fleurs du Mal,29.04,In stock,../media/cache/36/5b/365b3ab7ab72a6258873716aef6d5c1a.jpg,Five
Left Behind (Left Behind #1),40.72,In stock,../media/cache/d7/e2/d7e27f418884548ee1b551c67bcd222c.jpg,Two
Kill 'Em and Leave: Searching for James Brown and the American Soul,45.05,In stock,../media/cache/85/42/8542841f5644a6daf433504f1e106e97.jpg,Five
Kierkegaard: A Christian Missionary to Christians,47.13,In stock,../media/cache/05/ce/05ce699eaf78c0fae20308497c4f496a.jpg,One
John Vassos: Industrial Design for Modern Life,20.22,In stock,../media/cache/85/a1/85a19d4c20a4801013e8108a166d10af.jpg,Four
I'll Give You the Sun,56.48,In stock,../media/cache/af/93/af933f86038dc55487b5bf1d81ff4bfb.jpg,One
I Will Find You,44.21,In stock,../media/cache/87/28/8728f8880e95b848021f6a9b3dcd07ca.jpg,One
Hystopia: A Novel,21.96,In stock,../media/cache/2d/7b/2d7b77d8b45b2f8e1bc0ce20aacddad0.jpg,Four
Howl and Other Poems,40.45,In stock,../media/cache/b7/29/b7293f602efb0c17e305077f8175888a.jpg,Two
History of Beauty,10.29,In stock,../media/cache/58/a6/58a634c3231b5380544cc330536cb5ea.jpg,Four
Heaven is for Real: A Little Boy's Astounding Story of His Trip to Heaven and Back,52.86,In stock,../media/cache/58/6a/586afa8809f59bff51b89b2bc4a16129.jpg,Two
Future Shock (Future Shock #1),55.65,In stock,../media/cache/89/10/8910c36eec96636288a9cfb61610c9fa.jpg,Five
Ender's Game (The Ender Quintet #1),43.64,In stock,../media/cache/8a/0d/8a0d251ccece436f956df676c99e70f7.jpg,One
Diary of a Citizen Scientist: Chasing Tiger Beetles and Other New Ways of Engaging the World,28.41,In stock,../media/cache/33/4f/334fd0ebdf0c0192baf5914d199c53b5.jpg,One
Death by Leisure: A Cautionary Tale,37.51,In stock,../media/cache/7d/16/7d16c126f85826628bf9dcccd7a66b32.jpg,Four
Brilliant Beacons: A History of the American Lighthouse,11.45,In stock,../media/cache/56/cb/56cb66d73fb438d64af14dce8bd8b22b.jpg,Three
Brazen: The Courage to Find the You That's Been Hiding,19.22,In stock,../media/cache/3a/4f/3a4fb30cfc5742f4726bc9f807b66cda.jpg,Two
Between the World and Me,56.91,In stock,../media/cache/73/45/7345c412c4c821f131d3c159e027c3a0.jpg,Four
Being Mortal: Medicine and What Matters in the End,55.06,In stock,../media/cache/c7/7f/c77fdad22e40b8b923ec6c5b1f5a740f.jpg,Four
"A Murder Over a Girl: Justice, Gender, Junior High",13.2,In stock,../media/cache/56/31/56313728d302c83f2a8c70fba635ce33.jpg,Three
32 Yolks,53.63,In stock,../media/cache/1d/1f/1d1fbd89f0290275b9166877663ee9f5.jpg,Two
"""Most Blessed of the Patriarchs"": Thomas Jefferson and the Empire of the Imagination",44.48,In stock,../media/cache/11/af/11af7fbd6aec06a75fe207fae92b17e0.jpg,Five
You Are a Badass: How to Stop Doubting Your Greatness and Start Living an Awesome Life,12.08,In stock,../media/cache/9e/15/9e15d7add5090ff2a17bd71ac96aa55a.jpg,Three
Wildlife of New York: A Five-Borough Coloring Book,22.14,In stock,../media/cache/0c/07/0c07b114195b45c156f7f1e23820c49a.jpg,Two
What Happened on Beale Street (Secrets of the South Mysteries #2),25.37,In stock,../media/cache/c7/ab/c7abb5e32bd37118a87523dcee0a70a6.jpg,Five
Unreasonable Hope: Finding Faith in the God Who Brings Purpose to Your Pain,46.33,In stock,../media/cache/8b/10/8b102daec94d1ea9c6fc36dd3ec1c1fe.jpg,Two
Under the Tuscan Sun,37.33,In stock,../media/cache/98/c2/98c2e95c5fd1a4e7cd5f2b63c52826cb.jpg,Three
Toddlers Are A**holes: It's Not Your Fault,25.55,In stock,../media/cache/4c/30/4c3041def6f29659e009f61e45e492b0.jpg,One
The Year of Living Biblically: One Man's Humble Quest to Follow the Bible as Literally as Possible,34.72,In stock,../media/cache/8e/43/8e4335b369bdad5ccc1551e5592f89ac.jpg,One
The Whale,35.96,In stock,../media/cache/6c/18/6c18ea03e294bfcfe07cf531c6c5f5b3.jpg,Four
The Story of Art,41.14,In stock,../media/cache/bb/36/bb364a10868756d1c0877c928b43b533.jpg,Four
The Origin of Species,10.01,In stock,../media/cache/da/0d/da0d13699a090516502257a4d7da623f.jpg,Four
The Great Gatsby,36.05,In stock,../media/cache/28/cb/28cb7a5e23c1339a0d6aafd5e7e190d6.jpg,Four
The Good Girl,49.03,In stock,../media/cache/e2/71/e2718be90a081b33d2606a386b073998.jpg,Three
The Glass Castle,16.24,In stock,../media/cache/e0/e9/e0e97d416322d9728df7d9e589d6a998.jpg,One
The Faith of Christopher Hitchens: The Restless Soul of the World's Most Notorious Atheist,39.55,In stock,../media/cache/cc/a4/cca4e6a4cd5c207e7ce7d992ff464c3b.jpg,One
The Drowning Girls,35.67,In stock,../media/cache/f5/d9/f5d90537f3bed5ad7c8971190beb0730.jpg,Three
The Constant Princess (The Tudor Court #1),16.62,In stock,../media/cache/fc/80/fc80b999ff4b8ef24b7071f62d2bf6d1.jpg,Three
The Bourne Identity (Jason Bourne #1),42.78,In stock,../media/cache/40/8d/408d93b27ce8c9cfb3bf66c17e9a54ab.jpg,Four
The Bachelor Girl's Guide to Murder (Herringford and Watts Mysteries #1),52.3,In stock,../media/cache/95/d7/95d7541679fcbd579b8a4f2b47231aaf.jpg,Five
The Art Book,32.34,In stock,../media/cache/99/51/99511f4da1a4a2114e2ed12e6ba17b65.jpg,Two
The 7 Habits of Highly Effective People: Powerful Lessons in Personal Change,33.17,In stock,../media/cache/c9/c3/c9c3d568ff6ddb98bde01c9d0b1d920a.jpg,Four
Team of Rivals: The Political Genius of Abraham Lincoln,20.12,In stock,../media/cache/56/75/567575381760b5c1ec018d10d350fc5f.jpg,Five
Steal Like an Artist: 10 Things Nobody Told You About Being Creative,20.9,In stock,../media/cache/5f/17/5f17f0e06d7d67717eff3833d309a233.jpg,Two
"Sit, Stay, Love",20.9,In stock,../media/cache/8e/40/8e408552c2e7ee81cd60c03c79f604af.jpg,Three
Sister Dear,40.2,In stock,../media/cache/fa/57/fa570b7a0fb42252f61e1e750c79d417.jpg,Four
"Shrunken Treasures: Literary Classics, Short, Sweet, and Silly",52.87,In stock,../media/cache/4f/1e/4f1ece2500f8dbacecca42d57befca03.jpg,Three
"Rich Dad, Poor Dad",51.74,In stock,../media/cache/18/f4/18f45d31e3892fee589e23f15d759ee3.jpg,One
Raymie Nightingale,34.41,In stock,../media/cache/8f/66/8f66ec46e671d6fca79649c10c7c8f8a.jpg,Two
Playing from the Heart,32.38,In stock,../media/cache/1c/eb/1cebdf525ebe970a1dc3c5a8c50eae6b.jpg,One
Nightstruck: A Novel,50.35,In stock,../media/cache/c0/df/c0dfd5388bb38b9c24da2e94534e1198.jpg,Four
"Naturally Lean: 125 Nourishing Gluten-Free, Plant-Based Recipes--All Under 300 Calories",11.38,In stock,../media/cache/e6/b6/e6b66353f9325518994dd8b564290fd7.jpg,Five
Meternity,43.58,In stock,../media/cache/39/e3/39e33ebef2d7a35dd6899541eba8306d.jpg,Three
Memoirs of a Geisha,49.67,In stock,../media/cache/41/80/4180406c788ff3e0f37cd4491a260a5b.jpg,Three
Like Never Before (Walker Family #2),28.77,In stock,../media/cache/17/e2/17e264d978942f73b859fa1c1d2cf827.jpg,Two
Life of Pi,13.22,In stock,../media/cache/e7/ae/e7aee104ca78dac961bd906294fe88f1.jpg,Four
Leave This Song Behind: Teen Poetry at Its Best,51.17,In stock,../media/cache/31/c7/31c7c5ce7b04d227aa36ecb250b9dad5.jpg,Five
King's Folly (The Kinsman Chronicles #1),39.61,In stock,../media/cache/3e/2d/3e2d526ee062008ab1cbf54f90a5abb2.jpg,Five
John Adams,57.43,In stock,../media/cache/59/b4/59b4f94b4dc4c7cb844a6f24a5e2a41e.jpg,Four
How to Cook Everything Vegetarian: Simple Meatless Recipes for Great Food (How to Cook Everything),46.01,In stock,../media/cache/59/2d/592dc2dee11b798780f5ae613b970a34.jpg,Four
How to Be a Domestic Goddess: Baking and the Art of Comfort Cooking,28.25,In stock,../media/cache/e2/5c/e25cbc27ebc12e47cdf3f7adc87cccdc.jpg,Two
Good in Bed (Cannie Shapiro #1),37.05,In stock,../media/cache/1d/f4/1df443b1bd6d7a1d804b4780a666438f.jpg,Five
"Fruits Basket, Vol. 7 (Fruits Basket #7)",19.57,In stock,../media/cache/b4/36/b43672509477baa090e57ebeacbb28fb.jpg,One
For the Love: Fighting for Grace in a World of Impossible Standards,45.13,In stock,../media/cache/a7/d8/a7d8fda2a874567aab8f61b2b141a5e2.jpg,Three
Finding God in the Ruins: How God Redeems Pain,46.64,In stock,../media/cache/ae/2c/ae2ce9662ed6da3de501ff87551ccb2d.jpg,Two
Every Heart a Doorway (Every Heart A Doorway #1),12.16,In stock,../media/cache/50/d4/50d41a24990208deb72c9802a6c1e540.jpg,Five
Delivering the Truth (Quaker Midwife Mystery #1),20.89,In stock,../media/cache/57/31/5731a5d46c2c1e88977eb5e6d1337a2e.jpg,Four
Counted With the Stars (Out from Egypt #1),17.97,In stock,../media/cache/32/2c/322c1f6cce6d5a69a7d2321779195a0c.jpg,Five
"Chronicles, Vol. 1",52.6,In stock,../media/cache/11/fc/11fc94453c4dc0d68543971d7843afb0.jpg,Two
Blue Like Jazz: Nonreligious Thoughts on Christian Spirituality,25.77,In stock,../media/cache/a2/f5/a2f5b5fd4421d56d37c73a7fb29f5f40.jpg,One
Benjamin Franklin: An American Life,48.19,In stock,../media/cache/25/f8/25f869fa75340fca0fc2a68e8a0412a1.jpg,Three
"At The Existentialist Café: Freedom, Being, and apricot cocktails with: Jean-Paul Sartre, Simone de Beauvoir, Albert Camus, Martin Heidegger, Edmund Husserl, Karl Jaspers, Maurice Merleau-Ponty and others",29.93,In stock,../media/cache/de/76/de76d5c473c358bd41c03cf710692bfb.jpg,Five
A Summer In Europe,44.34,In stock,../media/cache/4e/15/4e15150388702ebca2c5a523ac270539.jpg,Two
A Short History of Nearly Everything,52.4,In stock,../media/cache/3c/f6/3cf646523ff7fb8647c500d6325cfcaf.jpg,Five
A Gathering of Shadows (Shades of Magic #2),44.81,In stock,../media/cache/48/b2/48b20fcc9ab722729de2c4da3d4de26e.jpg,Four
The Sound Of Love,57.84,In stock,../media/cache/4e/3a/4e3a151bbe2629a55df09fd318fdeb0a.jpg,Five
The Rise and Fall of the Third Reich: A History of Nazi Germany,39.67,In stock,../media/cache/e1/02/e102cefae5bb523bc67eb6b49bc18b5d.jpg,Two
The Perks of Being a Wallflower,55.02,In stock,../media/cache/ca/5b/ca5b33c09daab4667ed37b330de889bd.jpg,Three
The Mysterious Affair at Styles (Hercule Poirot #1),24.8,In stock,../media/cache/32/94/3294e5eaf73a37958583483fc9a90f04.jpg,Four
The Man Who Mistook His Wife for a Hat and Other Clinical Tales,59.45,In stock,../media/cache/92/fe/92fe1c1823653412fe68be2c525dfc3a.jpg,Four
The Makings of a Fatherless Child,31.58,In stock,../media/cache/6f/6c/6f6c7560e254f8242f86ef048f1ba7b3.jpg,Two
The Joy of Cooking,43.27,In stock,../media/cache/05/8e/058ebff59d12ebe40df1844bedd9366b.jpg,Four
The Invention of Wings,37.34,In stock,../media/cache/62/fa/62fa1e72f06f05762db5d9cedf654153.jpg,One
The Hobbit (Middle-Earth Universe),17.8,In stock,../media/cache/8b/d3/8bd38de5367fc675467431f343862569.jpg,Five
The Great Railway Bazaar,30.54,In stock,../media/cache/76/de/76de41867f323d7f1f4fbe2fdfc1b2ba.jpg,One
The Golden Compass (His Dark Materials #1),18.77,In stock,../media/cache/e7/9f/e79f81bfea1cb8b0503db022b64da713.jpg,One
The God Delusion,46.85,In stock,../media/cache/36/64/36643d44134c8a227988927013805e61.jpg,Three
The Girl You Left Behind (The Girl You Left Behind #1),15.79,In stock,../media/cache/d0/b6/d0b6d59c0662dcbd15d47add40af1ebd.jpg,One
The Fellowship of the Ring (The Lord of the Rings #1),10.27,In stock,../media/cache/ed/75/ed75000b92734d99b76a17954857327c.jpg,Two
The Collected Poems of W.B. Yeats (The Collected Works of W.B. Yeats #1),15.42,In stock,../media/cache/7e/93/7e934132cd03486649fb492fe702f704.jpg,Five
The Barefoot Contessa Cookbook,59.92,In stock,../media/cache/dd/07/dd07bd0c443756b9dc260813c1949b4f.jpg,Five
Tell the Wolves I'm Home,50.96,In stock,../media/cache/f9/72/f972e744117c9d4b5fefb3410c0e9f7c.jpg,Two
Ship Leaves Harbor: Essays on Travel by a Recovering Journeyman,30.6,In stock,../media/cache/31/b0/31b0e0a42826b326e43235beb8ddd783.jpg,Three
Pride and Prejudice,19.27,In stock,../media/cache/c8/09/c80991f861675b6e75dc7f2f6a50e5a0.jpg,Four
Musicophilia: Tales of Music and the Brain,46.58,In stock,../media/cache/02/66/02667c5b8f5a5e9e45c0799518f086ca.jpg,One
Mere Christianity,48.51,In stock,../media/cache/d2/90/d29093abd0b9d5258e2e08b731778158.jpg,Three
Me Before You (Me Before You #1),19.02,In stock,../media/cache/a2/cd/a2cd0016b37c0407059147e58e14afe5.jpg,One
In the Woods (Dublin Murder Squad #1),38.38,In stock,../media/cache/24/a1/24a175dac7cb91ff26e2d723cdc6e098.jpg,Two
In Cold Blood,49.98,In stock,../media/cache/eb/4e/eb4ea9c04dccab509451ba31feb6b4e8.jpg,Four
How to Stop Worrying and Start Living,46.49,In stock,../media/cache/4f/08/4f08f7948770912e4e340e10caa604cb.jpg,Five
Give It Back,18.32,In stock,../media/cache/8b/7c/8b7c73e075cc687b6890dc0dca9fcbcc.jpg,Two
"Girl, Interrupted",42.14,In stock,../media/cache/f9/ec/f9ec97bd8b29cc4e36d6c2b093d04709.jpg,Three
Fun Home: A Family Tragicomic,56.59,In stock,../media/cache/54/ae/54ae8233e8422676c241d1cea0b67f1d.jpg,Four
"Fruits Basket, Vol. 6 (Fruits Basket #6)",20.96,In stock,../media/cache/94/1a/941a14dec32f0a949c38a325a715c138.jpg,Four
Deception Point,40.32,In stock,../media/cache/fa/2d/fa2d3198b7ba9785e0edd6f41b84d72b.jpg,Four
"Death Note, Vol. 6: Give-and-Take (Death Note #6)",36.39,In stock,../media/cache/07/5c/075c210f5ce43b84d29646a54529d1bd.jpg,Three
Catherine the Great: Portrait of a Woman,58.55,In stock,../media/cache/72/f1/72f13b8f069d3a018d2c378be5a1de20.jpg,Four
Better Homes and Gardens New Cook Book,39.61,In stock,../media/cache/75/82/7582e20b84f603358a8d55cd6a0a50f4.jpg,Three
An Unquiet Mind: A Memoir of Moods and Madness,21.3,In stock,../media/cache/00/29/002924b764dc367dcaa3486fa4c0aa0b.jpg,Three
A Year in Provence (Provence #1),56.88,In stock,../media/cache/db/46/db46159b05faa5d95262112bf9c29ddd.jpg,Four
World Without End (The Pillars of the Earth #2),32.97,In stock,../media/cache/be/7c/be7ce6fbc9a8e1a5a5b5c32e73cfd78a.jpg,Four
"Will Grayson, Will Grayson (Will Grayson, Will Grayson)",47.31,In stock,../media/cache/de/a1/dea174c8a8dbfd98e5e05c9e479a52b2.jpg,Four
Why Save the Bankers?: And Other Essays on Our Economic and Political Crisis,48.67,In stock,../media/cache/16/f5/16f545b2e14c16ed4bd0e098a0700b57.jpg,Two
Where She Went (If I Stay #2),41.73,In stock,../media/cache/05/86/0586b3d79013f606494e843de1faea0b.jpg,Four
What If?: Serious Scientific Answers to Absurd Hypothetical Questions,53.68,In stock,../media/cache/59/bc/59bcc421ae9f5a6f12ef11e849fb745d.jpg,Four
Two Summers,14.64,In stock,../media/cache/89/16/89165d7488fbaa9e60cfcabe56796288.jpg,One
This Is Your Brain on Music: The Science of a Human Obsession,38.4,In stock,../media/cache/35/a4/35a4a7c6c76c4e82186753078e441654.jpg,One
The Secret Garden,15.08,In stock,../media/cache/c5/46/c5465a06182ed6ebfa40d049258a2f58.jpg,Four
The Raven King (The Raven Cycle #4),30.57,In stock,../media/cache/da/54/da54d953f00d1e465f31f865df3d0f3f.jpg,Two
The Raven Boys (The Raven Cycle #1),57.74,In stock,../media/cache/3c/a4/3ca4889e4bb7f9a1cc1d7a1c920e9d42.jpg,Four
The Power Greens Cookbook: 140 Delicious Superfood Recipes,11.05,In stock,../media/cache/82/1d/821d2c02dcd0a10fc9d533917482746e.jpg,Five
The Metamorphosis,28.58,In stock,../media/cache/4a/1b/4a1b6e9c1af75db0dc34ae63344f6883.jpg,One
The Mathews Men: Seven Brothers and the War Against Hitler's U-boats,42.91,In stock,../media/cache/f2/64/f26457d65a03b2636c4bcc7c318f7346.jpg,Five
The Little Paris Bookshop,24.73,In stock,../media/cache/50/a9/50a901fb008c0b8965c8d4da2dff5470.jpg,Three
The Hiding Place,55.91,In stock,../media/cache/cf/18/cf187c1dc5575fcbbf49c58024146c4b.jpg,Four
The Grand Design,13.76,In stock,../media/cache/08/a9/08a957eb34f8047862e225774c3bdde2.jpg,Three
The Firm,45.56,In stock,../media/cache/95/84/95847132a78de44b7249a2d0a3fe3ef6.jpg,Three
The Fault in Our Stars,47.22,In stock,../media/cache/69/61/696100859e82b2ec7a796129d6cca44a.jpg,One
The False Prince (The Ascendance Trilogy #1),56.0,In stock,../media/cache/f8/e3/f8e371e2869d13b9d89999f8d5173245.jpg,Five
The Expatriates,44.58,In stock,../media/cache/db/e4/dbe49e1cb06136eeb51182f551ccdc52.jpg,Two
The Dream Thieves (The Raven Cycle #2),34.5,In stock,../media/cache/d9/7a/d97a3a4a65b5275ab506b28c7a88e0a5.jpg,One
The Darkest Corners,11.33,In stock,../media/cache/c1/ab/c1ab73a20d02b5f3a5599e7c5704a909.jpg,Five
The Crossover,38.77,In stock,../media/cache/9f/35/9f351ca1978128c60a3b7f85987075b3.jpg,Four
The 5th Wave (The 5th Wave #1),11.83,In stock,../media/cache/10/d0/10d0c5e47d0e8cce16b6b5e6be48cb16.jpg,Two
Tell the Wind and Fire,45.51,In stock,../media/cache/3b/0c/3b0c5f4df26b73659af4e25107499384.jpg,Three
Tell Me Three Things,41.81,In stock,../media/cache/a1/2f/a12f0bec8c8728800f901b4e5f6e3f9a.jpg,One
Talking to Girls About Duran Duran: One Young Man's Quest for True Love and a Cooler Haircut,25.15,In stock,../media/cache/07/8b/078b934613af473daf7ecf918e05d050.jpg,Four
Siddhartha,34.22,In stock,../media/cache/ce/0b/ce0be2d86e388540122c222306c6d62c.jpg,Five
Shiver (The Wolves of Mercy Falls #1),16.23,In stock,../media/cache/84/73/847399651d8f2dfae1a0d5a0ea4064b2.jpg,Five
Remember Me?,11.48,In stock,../media/cache/3f/95/3f9572f94858197e92786b194f0f12df.jpg,Three
Red Dragon (Hannibal Lecter #1),23.37,In stock,../media/cache/30/66/3066f8bcd2e2ed6b45084355ff084a61.jpg,Three
Peak: Secrets from the New Science of Expertise,16.28,In stock,../media/cache/83/ab/83ab65f938b24fa1a9cb47235be49b57.jpg,Two
My Mother Was Nuts,31.63,In stock,../media/cache/9b/b4/9bb42bf833e91193ca05badddded4bfb.jpg,Four
Mexican Today: New and Rediscovered Recipes for Contemporary Kitchens,24.91,In stock,../media/cache/5d/02/5d029bff299cdb777e06f35800faa628.jpg,Five
Maybe Something Beautiful: How Art Transformed a Neighborhood,22.54,In stock,../media/cache/c0/bb/c0bb6e42743b9c1aaf9b754501100a5d.jpg,One
Lola and the Boy Next Door (Anna and the French Kiss #2),23.63,In stock,../media/cache/bc/c8/bcc8374e0c81ded1486b6225ca4fe78a.jpg,Four
Logan Kade (Fallen Crest High #5.5),13.12,In stock,../media/cache/d9/4e/d94e6206c2decd3acd9a61b2cbac7eaf.jpg,Two
Last One Home (New Beginnings #1),59.98,In stock,../media/cache/e4/0a/e40a336622fe578699be5a1eeba18f9d.jpg,Three
Killing Floor (Jack Reacher #1),31.49,In stock,../media/cache/eb/e9/ebe9f06ccebf83d9853a846052b58fff.jpg,Four
Kill the Boy Band,15.52,In stock,../media/cache/05/74/0574a71ccaff1fef1f8e9a1f4c22b7bc.jpg,Five
Isla and the Happily Ever After (Anna and the French Kiss #3),48.13,In stock,../media/cache/0d/0b/0d0bd1fce3e0171cf101764393caea41.jpg,Five
If I Stay (If I Stay #1),38.13,In stock,../media/cache/cb/b3/cbb3754c7bae0d54dcf561aed4f9d6e3.jpg,Five
I Know Why the Caged Bird Sings (Maya Angelou's Autobiography #1),36.55,In stock,../media/cache/c1/42/c14297e48de02ac420c587822ff329ab.jpg,Two
Harry Potter and the Deathly Hallows (Harry Potter #7),23.32,In stock,../media/cache/58/e4/58e434a6a4eb267eac7aa529b0c2ec15.jpg,One
"Fruits Basket, Vol. 5 (Fruits Basket #5)",16.33,In stock,../media/cache/51/cf/51cf19c74f21a7043910615fefcf0847.jpg,One
Foundation (Foundation (Publication Order) #1),32.42,In stock,../media/cache/8b/92/8b9267df86378b6973974ae7e1924ffe.jpg,One
Fool Me Once,16.96,In stock,../media/cache/b6/9c/b69c4ea86e09921aabc4e0431a8273a5.jpg,One
Find Her (Detective D.D. Warren #8),22.37,In stock,../media/cache/f6/f2/f6f2094e8a318093fa53784df2bfeab8.jpg,One
Evicted: Poverty and Profit in the American City,42.27,In stock,../media/cache/d0/4f/d04f8176cf0527b293114173d01999d7.jpg,One
Drama,38.7,In stock,../media/cache/68/ce/68ce8be6a167f510d07a7da637b62c6f.jpg,Two
Dracula the Un-Dead,35.63,In stock,../media/cache/13/ff/13fffcde653948339d3427184b7bd0b5.jpg,Five
Digital Fortress,58.0,In stock,../media/cache/5c/77/5c770b251d27aeef263f8ae974ca02e0.jpg,Five
"Death Note, Vol. 5: Whiteout (Death Note #5)",52.41,In stock,../media/cache/4e/c1/4ec161cc09ee437c9eda6d437d232a11.jpg,One
"Data, A Love Story: How I Gamed Online Dating to Meet My Match",32.35,In stock,../media/cache/1f/d8/1fd8340d9b3fd95861f0407b4dbb0fa7.jpg,Three
Critique of Pure Reason,20.75,In stock,../media/cache/12/6e/126ef8f6473b81808ebbb9cff155e883.jpg,One
Booked,17.49,In stock,../media/cache/8f/46/8f46bb13feb3a4440a27dfcf688fbaa6.jpg,Five
"Blue Lily, Lily Blue (The Raven Cycle #3)",34.13,In stock,../media/cache/db/14/db14903b3a56a297ef6aefe7624d637f.jpg,Five
Approval Junkie: Adventures in Caring Too Much,58.81,In stock,../media/cache/17/aa/17aacb738eace89a635a4eb47a94c11d.jpg,Five
An Abundance of Katherines,10.0,In stock,../media/cache/ed/45/ed4517339d4780f4158c485c83850d20.jpg,Five
America's War for the Greater Middle East: A Military History,51.22,In stock,../media/cache/eb/17/eb178eceef1e9290591cabd5155571a3.jpg,Two
Alight (The Generations Trilogy #2),58.59,In stock,../media/cache/5e/f3/5ef34ba3e937218db15178a1a5ce195f.jpg,Four
A Girl's Guide to Moving On (New Beginnings #2),31.3,In stock,../media/cache/f7/a9/f7a90a63f66ac92cc280def001970ed2.jpg,One
A Game of Thrones (A Song of Ice and Fire #1),46.42,In stock,../media/cache/13/d1/13d11b26b46484ee73e9923ff307a7b4.jpg,Two
A Feast for Crows (A Song of Ice and Fire #4),17.21,In stock,../media/cache/b3/6b/b36b278233baf55ebaad761d8d3d0fec.jpg,Four
A Clash of Kings (A Song of Ice and Fire #2),10.79,In stock,../media/cache/1a/29/1a298a157f4113d6e0127521aaa1f5f0.jpg,Three
Vogue Colors A to Z: A Fashion Coloring Book,52.35,In stock,../media/cache/1f/55/1f5541682b39b390a3db41430922d510.jpg,Four
The Shining (The Shining #1),27.88,In stock,../media/cache/db/96/db9686744f93c0e9ff3945144827f99a.jpg,Three
The Pilgrim's Progress,50.26,In stock,../media/cache/45/bb/45bb59d19eb3aa868293d44809078418.jpg,Two
The Perfect Play (Play by Play #1),59.99,In stock,../media/cache/40/16/4016ffba678f309171d8130135f6eb8e.jpg,Three
