title,price,stock,image,category
The Passion of Dolssa,28.32,In stock,../media/cache/6b/82/6b822681c4035131560d40dd3b5a6a2e.jpg,Five
The Jazz of Physics: The Secret Link Between Music and the Structure of the Universe,38.71,In stock,../media/cache/2d/32/2d32efe1c5f97510596a2cc21c5daf5d.jpg,Three
The Hunger Games (The Hunger Games #1),29.85,In stock,../media/cache/41/c7/41c72a9c7733fc5f7434b2fa33060c54.jpg,Five
The Hound of the Baskervilles (Sherlock Holmes #5),14.82,In stock,../media/cache/1f/b0/1fb03cdabe6001c8a2620f65e025cbd5.jpg,Two
The Gunning of America: Business and the Making of American Gun Culture,16.81,In stock,../media/cache/28/a8/28a8784d0b38b148a35bce421dc16910.jpg,Four
The Geography of Bliss: One Grump's Search for the Happiest Places in the World,28.23,In stock,../media/cache/bd/a0/bda0fa21e6d06862920c0eedecc6201e.jpg,Two
The Demonists (Demonist #1),52.11,In stock,../media/cache/1a/d2/1ad2a260776198051f4d1849be347cc6.jpg,Two
"The Demon Prince of Momochi House, Vol. 4 (The Demon Prince of Momochi House #4)",27.88,In stock,../media/cache/47/71/477173fe3000a6da4b241c2e71a21418.jpg,Two
The Bone Hunters (Lexy Vaughan & Steven Macaulay #2),59.71,In stock,../media/cache/ee/d4/eed4d5d63d13f0aa86575c90f8ccacb7.jpg,Three
The Beast (Black Dagger Brotherhood #14),46.08,In stock,../media/cache/1b/3f/1b3f5057f9e7f7cb81a8c10b58024145.jpg,Five
Some Women,13.73,In stock,../media/cache/27/b7/27b7f4ec590965b5acc15dc4b1376684.jpg,Five
Shopaholic Ties the Knot (Shopaholic #3),48.39,In stock,../media/cache/ac/ba/acba5e4e1813b8c1fff4890f1efef3ab.jpg,Five
Paper and Fire (The Great Library #2),49.45,In stock,../media/cache/a7/04/a704d4248b21c0cdd8038c1b8345ed17.jpg,Five
Outlander (Outlander #1),19.67,In stock,../media/cache/b1/0b/b10ba73e67297fc8ed9e877bdcf60813.jpg,Five
"Orchestra of Exiles: The Story of Bronislaw Huberman, the Israel Philharmonic, and the One Thousand Jews He Saved from Nazi Horrors",12.36,In stock,../media/cache/15/de/15de75548ee9a4c6be1420ee309c03e0.jpg,Three
No One Here Gets Out Alive,20.02,In stock,../media/cache/7a/7e/7a7eb52e7075a5305522948375c1316e.jpg,Five
Night Shift (Night Shift #1-20),12.75,In stock,../media/cache/c0/02/c0029d48c2588e6d2a6a31c9f96088ba.jpg,Four
Needful Things,47.51,In stock,../media/cache/2d/e0/2de0eff716ca13d12cf5420e88e1a8b3.jpg,Four
Mockingjay (The Hunger Games #3),20.44,In stock,../media/cache/76/b4/76b462eda7a84ccf39a543d63c695ca7.jpg,Four
Misery,34.79,In stock,../media/cache/7c/93/7c9302e392e128881e926d19f761da33.jpg,Two
Little Women (Little Women #1),28.07,In stock,../media/cache/81/f5/81f559ebe403317226fa8b611e35ce8a.jpg,Four
It,25.01,In stock,../media/cache/f7/b7/f7b73392b12909a1e8261ef3f96c5fd1.jpg,Three
Harry Potter and the Sorcerer's Stone (Harry Potter #1),13.9,In stock,../media/cache/04/c8/04c8a51d23d4335d300324e917ca4d8f.jpg,Three
Harry Potter and the Prisoner of Azkaban (Harry Potter #3),24.17,In stock,../media/cache/d1/fb/d1fbdddb0d4fb0c445a33c6d003d0990.jpg,Four
Harry Potter and the Order of the Phoenix (Harry Potter #5),31.63,In stock,../media/cache/96/11/9611147982037cd7d79483452938c10f.jpg,Four
Harry Potter and the Half-Blood Prince (Harry Potter #6),48.75,In stock,../media/cache/c8/24/c8248518fb59de3a798a4b5baae949b5.jpg,Five
Harry Potter and the Chamber of Secrets (Harry Potter #2),14.74,In stock,../media/cache/fc/08/fc08dcfc1ae86bbd5bc0bca74c9b6d3d.jpg,One
Gone with the Wind,32.49,In stock,../media/cache/27/82/2782701b5c877cb063065b9fc14c5b13.jpg,Three
God Is Not Great: How Religion Poisons Everything,27.8,In stock,../media/cache/d2/80/d280aed3d0c46653a9c33f76559e9e6d.jpg,One
Girl With a Pearl Earring,26.77,In stock,../media/cache/b7/ad/b7ad37d93d8401c84d7325aa645ff6d5.jpg,One
"Fruits Basket, Vol. 4 (Fruits Basket #4)",50.44,In stock,../media/cache/38/79/38794d8729a111018260d931e7101de2.jpg,Four
Far From True (Promise Falls Trilogy #2),34.93,In stock,../media/cache/87/54/8754267f27581996f93e8d94d3c04bf9.jpg,Two
Dark Lover (Black Dagger Brotherhood #1),12.87,In stock,../media/cache/3c/a2/3ca2e61181fc1122658af8f85354bae8.jpg,One
Confessions of a Shopaholic (Shopaholic #1),48.94,In stock,../media/cache/e3/b5/e3b5a3dcc2993295f5a6fb429052799c.jpg,Two
Changing the Game (Play by Play #2),13.38,In stock,../media/cache/57/47/57472d9c6d483bee9c38c90bfa10b3ee.jpg,Three
Candide,58.63,In stock,../media/cache/e3/c4/e3c4aba2409bb769a6488805e3fc4709.jpg,Three
Can You Keep a Secret?,21.94,In stock,../media/cache/72/73/7273ff1bfe3b0a6aab7f54ddf9be7b44.jpg,One
Atlas Shrugged,26.58,In stock,../media/cache/a5/4f/a54fea8d034eba2ee4d1b8af30f1a308.jpg,Five
Animal Farm,57.22,In stock,../media/cache/10/db/10db56354b4550d92270c6f097d9bebc.jpg,Three
A Walk to Remember,56.43,In stock,../media/cache/fa/1b/fa1b0fac146201645c740b02802e2211.jpg,One
A New Earth: Awakening to Your Life's Purpose,55.65,In stock,../media/cache/83/c8/83c834b3779be4e577c37ead6d2acf65.jpg,Five
"A History of God: The 4,000-Year Quest of Judaism, Christianity, and Islam",27.62,In stock,../media/cache/71/91/7191a7d76eb6c3a18259541e2c038ae3.jpg,One
'Salem's Lot,49.56,In stock,../media/cache/ee/d3/eed3afc5e444e3da5eec34e2b0036ec7.jpg,Four
Zero History (Blue Ant #3),34.77,In stock,../media/cache/74/52/74524b04dc99cbfc7bf5d37fcc1489ab.jpg,One
Wuthering Heights,17.73,In stock,../media/cache/93/4e/934e966c1ddf559d3ac2b5c1407aaf1e.jpg,Three
World War Z: An Oral History of the Zombie War,21.8,In stock,../media/cache/7e/bf/7ebfa1c62b21beeaad37a6474a39cfe8.jpg,One
Wild: From Lost to Found on the Pacific Crest Trail,46.02,In stock,../media/cache/c8/41/c841873951efb18dea28162452efff58.jpg,Three
"Where'd You Go, Bernadette",18.13,In stock,../media/cache/c6/7e/c67eb0d6e56c4459e8c0d45c08471a89.jpg,One
When You Are Engulfed in Flames,30.89,In stock,../media/cache/73/36/733662595aede2dff1a5be1e76a3b936.jpg,Five
We the People: The Modern-Day Figures Who Have Reshaped and Affirmed the Founding Fathers' Vision of America,31.95,In stock,../media/cache/f6/52/f65271ce557e9192537e24847bbb1210.jpg,Three
We Are All Completely Beside Ourselves,24.04,In stock,../media/cache/4d/18/4d1891e435c6692c864331c585e0d014.jpg,One
Walk the Edge (Thunder Road #2),32.36,In stock,../media/cache/61/2c/612ce7fa4cbee472392ce8721a4e863e.jpg,Three
Voyager (Outlander #3),21.07,In stock,../media/cache/b5/d8/b5d813da01f2ccd7bcfe34e2b875e752.jpg,Five
Very Good Lives: The Fringe Benefits of Failure and the Importance of Imagination,50.66,In stock,../media/cache/ab/ac/abac4222af5cc296b704a0e5df82e162.jpg,Three
Vegan Vegetarian Omnivore: Dinner for Everyone at the Table,13.66,In stock,../media/cache/80/63/80631f8bca036361343fdce528725654.jpg,Two
"Unstuffed: Decluttering Your Home, Mind, and Soul",58.09,In stock,../media/cache/14/07/1407c2d6318956b10abd970c2e83154d.jpg,One
Under the Banner of Heaven: A Story of Violent Faith,30.0,In stock,../media/cache/14/2f/142f99787241bb65e031a76e74e14d1b.jpg,One
Two Boys Kissing,32.74,In stock,../media/cache/53/bd/53bd80b1fc1914f418dc31a9d6571cb1.jpg,Two
Twilight (Twilight #1),41.93,In stock,../media/cache/70/10/7010c24f80a4172f7405677ef0592f26.jpg,Two
Twenties Girl,42.8,In stock,../media/cache/a0/fa/a0fa38039f6a674a7c89dfe2be866259.jpg,Two
"Trespassing Across America: One Man's Epic, Never-Done-Before (and Sort of Illegal) Hike Across the Heartland",53.51,In stock,../media/cache/77/bc/77bcc3cde72998ee488ac169f7e4e540.jpg,One
Three-Martini Lunch,23.21,In stock,../media/cache/1d/8e/1d8eb8aaebd14464fc58a681091b8d45.jpg,Three
"Thinking, Fast and Slow",21.14,In stock,../media/cache/b4/a5/b4a56663d56f1e84ee1b15bd819563cc.jpg,One
The Wild Robot,56.07,In stock,../media/cache/bf/db/bfdbf9726621276fc7821d705690dbae.jpg,Three
"The Wicked + The Divine, Vol. 3: Commercial Suicide (The Wicked + The Divine)",14.41,In stock,../media/cache/ee/ed/eeeddf8af9e6cc8c7f71c0e41de1b562.jpg,Three
The Undomestic Goddess,45.75,In stock,../media/cache/13/8f/138f4cf84be250d08e1f5c1db3643dbc.jpg,Four
The Travelers,15.77,In stock,../media/cache/2a/a8/2aa8afd15f97617ab75f616766161cda.jpg,One
The Tipping Point: How Little Things Can Make a Big Difference,10.02,In stock,../media/cache/27/3d/273d4c813111bc482e8c473ebd90fbbb.jpg,Two
The Thing About Jellyfish,48.77,In stock,../media/cache/e0/90/e090748ce5a567207aed9185c97eb34b.jpg,One
The Stand,57.86,In stock,../media/cache/3a/7c/3a7c2393061031e7911d7b533b723391.jpg,Two
The Smitten Kitchen Cookbook,23.59,In stock,../media/cache/8e/09/8e09faaea71886048b27959e607e6c7b.jpg,One
The Silkworm (Cormoran Strike #2),23.05,In stock,../media/cache/3a/2c/3a2c46cd40a7ecbd7c40815d6390fb8a.jpg,Five
"The Sandman, Vol. 3: Dream Country (The Sandman (volumes) #3)",55.55,In stock,../media/cache/bb/18/bb1845c22faea465cad3d556d22936a2.jpg,Five
The Rose & the Dagger (The Wrath and the Dawn #2),58.64,In stock,../media/cache/57/9c/579cd2ca789c8a796a1864d08ee8d686.jpg,Four
The Road to Little Dribbling: Adventures of an American in Britain (Notes From a Small Island #2),23.21,In stock,../media/cache/e0/4f/e04f8eda2a2fa947aec17640202d9ab0.jpg,One
The Rise of Theodore Roosevelt (Theodore Roosevelt #1),42.57,In stock,../media/cache/ff/d4/ffd45d95f314555e20c923d3522adea7.jpg,Three
The Restaurant at the End of the Universe (Hitchhiker's Guide to the Galaxy #2),10.92,In stock,../media/cache/b8/b2/b8b2956acc758a381beef87339c0a52f.jpg,One
The Rest Is Noise: Listening to the Twentieth Century,34.77,In stock,../media/cache/4d/e1/4de1d174bf4ab498788c9488c9fd29fc.jpg,One
The Red Tent,35.66,In stock,../media/cache/b2/8f/b28f211e50e74445ca071d4279d1080d.jpg,Five
The Purpose Driven Life: What on Earth Am I Here for?,37.19,In stock,../media/cache/95/08/9508e6b28fe4c63e67b3ef33f11eff98.jpg,Three
The Purest Hook (Second Circle Tattoos #3),12.25,In stock,../media/cache/15/68/1568ef85fdb4e405b9f8bc62ef855c10.jpg,One
The Picture of Dorian Gray,29.7,In stock,../media/cache/a6/72/a67245346daa38c2b23a4fc64c6e7115.jpg,Two
The Paris Wife,36.8,In stock,../media/cache/01/c8/01c847671683538fcf084eede54d6270.jpg,Three
The Obsession,45.43,In stock,../media/cache/24/93/2493c74c614afcc435cc00e33bd55f64.jpg,One
The Nightingale,26.26,In stock,../media/cache/77/aa/77aa0ef1f62a0b0b40000a81f65c4e65.jpg,Four
The New Guy (and Other Senior Year Distractions),44.92,In stock,../media/cache/d8/9d/d89dc869d5ea1462fd746ac6de97583f.jpg,Three
The Nanny Diaries (Nanny #1),52.53,In stock,../media/cache/63/5f/635fb981e464f7427787824b20a15e71.jpg,Five
The Name of God is Mercy,37.25,In stock,../media/cache/d2/41/d241ca89679593a589a6614162ab6eb6.jpg,Two
The Maze Runner (The Maze Runner #1),20.93,In stock,../media/cache/5e/87/5e87e44785de47c2a03091deaa82330f.jpg,One
The Lover's Dictionary,58.09,In stock,../media/cache/47/e7/47e7563b0731a2b8131233f70d211f7a.jpg,Two
The Lonely Ones,43.59,In stock,../media/cache/21/bd/21bdf7ae21476b1debf4aa3eefe6f29d.jpg,Five
The Lean Startup: How Today's Entrepreneurs Use Continuous Innovation to Create Radically Successful Businesses,33.92,In stock,../media/cache/39/f1/39f167dff90d7f84f5c8dc5e05d4051b.jpg,Three
The Last Painting of Sara de Vos,55.55,In stock,../media/cache/bf/fd/bffd473ab232c5f35e8c81bb927f1624.jpg,Two
"The Land of 10,000 Madonnas",29.64,In stock,../media/cache/ae/93/ae93b007df22c99ea2ff2f907b06663e.jpg,Four
The Infinities,27.41,In stock,../media/cache/9c/44/9c445b33d53b3810f1c12f4adad71a27.jpg,One
The Husband's Secret,52.51,In stock,../media/cache/f0/5b/f05be79a4b319e24819c318e35e6963c.jpg,Five
The Hitchhiker's Guide to the Galaxy (Hitchhiker's Guide to the Galaxy #1),47.8,In stock,../media/cache/41/74/41747f533b211d324799a03dc64ed175.jpg,Three
The Guns of August,14.54,In stock,../media/cache/06/c8/06c897070611b78b80a37333cbb7851c.jpg,Two
The Guernsey Literary and Potato Peel Pie Society,49.53,In stock,../media/cache/18/f7/18f7bf6366cd7a8b947fd790d808047b.jpg,One
The Goldfinch,43.58,In stock,../media/cache/fb/4d/fb4dde3351d00ef104f29aeecd2d41fb.jpg,Three
The Giver (The Giver Quartet #1),12.3,In stock,../media/cache/b3/ed/b3eda9490c9e2ed02c3a8650e687731b.jpg,One
The Girl with All the Gifts,49.47,In stock,../media/cache/41/c7/41c74d82b853606fe98182c417b4669c.jpg,Three
The Girl Who Played with Fire (Millennium Trilogy #2),22.14,In stock,../media/cache/11/71/117145e4525b2e801e2cd1ba4dd70441.jpg,Two
The Girl Who Kicked the Hornet's Nest (Millennium Trilogy #3),57.48,In stock,../media/cache/2a/a2/2aa2d8c4a8bfc1972c806ca16718e5c5.jpg,One
The Exiled,43.45,In stock,../media/cache/2d/1a/2d1aeb1cc8a23064164e230fa232cc04.jpg,Three
"The End of Faith: Religion, Terror, and the Future of Reason",22.13,In stock,../media/cache/9d/56/9d5631724c6496b2f012fa5d2f2b6abd.jpg,Four
"The Elegant Universe: Superstrings, Hidden Dimensions, and the Quest for the Ultimate Theory",13.03,In stock,../media/cache/69/c8/69c83860995cde393dbe6690ec3f1d4f.jpg,Four
"The Disappearing Spoon: And Other True Tales of Madness, Love, and the History of the World from the Periodic Table of the Elements",57.35,In stock,../media/cache/f9/69/f969969428b505970a46272fdcea00d3.jpg,Five
The Devil Wears Prada (The Devil Wears Prada #1),44.29,In stock,../media/cache/87/d3/87d34d376555dd0cb75030d1059cc144.jpg,One
The Demon-Haunted World: Science as a Candle in the Dark,52.25,In stock,../media/cache/4a/35/4a352dc298e4bbe6ba5f81bbc0d41ca0.jpg,Four
The Day the Crayons Came Home (Crayons),26.33,In stock,../media/cache/ec/08/ec08efebaa33a403e54080b48c139794.jpg,Five
The Da Vinci Code (Robert Langdon #2),22.96,In stock,../media/cache/cf/d5/cfd553eaa00f4d6091c459081cd98199.jpg,Two
The Cuckoo's Calling (Cormoran Strike #1),19.21,In stock,../media/cache/11/81/11815f24d043f77d4f09a3522a688a5c.jpg,One
The Complete Stories and Poems (The Works of Edgar Allan Poe [Cameo Edition]),26.78,In stock,../media/cache/42/c4/42c48f11b7e70a0f76c5ba9cb5c5018a.jpg,Four
The Complete Poems,41.32,In stock,../media/cache/e5/f2/e5f270cf4a079a7d411439abe17691e0.jpg,Five
The Catcher in the Rye,24.55,In stock,../media/cache/70/f4/70f4dbf8110363f4e7ef32db0ce2a675.jpg,One
The Cat in the Hat (Beginner Books B-1),16.26,In stock,../media/cache/9b/f1/9bf106306301a44635aa7bd381c84e4d.jpg,Two
The Case for Christ (Cases for Christianity),47.84,In stock,../media/cache/12/3d/123d05986974943a58c5cfa518e11e6d.jpg,One
The Book Thief,53.49,In stock,../media/cache/ff/a0/ffa08bf29ae0a5c9e91564dba71cde90.jpg,Two
The Book of Basketball: The NBA According to The Sports Guy,44.84,In stock,../media/cache/61/2c/612caeb0b2acb35c100629f0f52a40d7.jpg,Five
The Blind Side: Evolution of a Game,53.71,In stock,../media/cache/5e/ee/5eeecab909b9e87ddfb6e3d31078fbbf.jpg,Five
The Autobiography of Malcolm X,23.43,In stock,../media/cache/84/07/84074b59293cc5bf4012ef0f60e90c4f.jpg,Two
"The Art of Simple Food: Notes, Lessons, and Recipes from a Delicious Revolution",34.32,In stock,../media/cache/96/57/9657c6d89024e343879a7b5512474f1e.jpg,Three
The Art of Fielding,22.1,In stock,../media/cache/68/a6/68a6112c857e595c684f2a1a3287ba16.jpg,One
"Surely You're Joking, Mr. Feynman!: Adventures of a Curious Character",25.83,In stock,../media/cache/f8/bc/f8bcd489d33473e0819beaecccd5ebac.jpg,Two
Stiff: The Curious Lives of Human Cadavers,36.74,In stock,../media/cache/a0/a0/a0a013b029130df92073f547df83ee5c.jpg,Three
Spilled Milk: Based on a True Story,49.51,In stock,../media/cache/a8/0d/a80d4310cab08a3660149fd3f2cf15c7.jpg,One
Something Borrowed (Darcy & Rachel #1),48.96,In stock,../media/cache/6d/6d/6d6d5799190b4f9ef89f3bbc8b67d60d.jpg,Five
Something Blue (Darcy & Rachel #2),54.62,In stock,../media/cache/72/f5/72f5ed312bc82afa386c9cd48d4e36dd.jpg,One
Soldier (Talon #3),24.72,In stock,../media/cache/7b/96/7b96f6e11b388ee800c7fd17fe479444.jpg,Two
Shopaholic & Baby (Shopaholic #5),46.45,In stock,../media/cache/f0/a4/f0a48c8cc6acd322eacd9d35e55d63e7.jpg,Two
Seven Days in the Art World,52.33,In stock,../media/cache/35/2c/352c1a7e155c5d03d073bf8ce1564caa.jpg,Two
Seven Brief Lessons on Physics,30.6,In stock,../media/cache/c8/63/c863c222c130a1bc8685a1242dd2523d.jpg,Four
Scarlet (The Lunar Chronicles #2),14.57,In stock,../media/cache/b6/5c/b65c3622c0da689990fd1d7f1a0b826c.jpg,Four
Sarah's Key,46.29,In stock,../media/cache/95/b2/95b235aeeae2d1849b78562f36e10aec.jpg,One
"Saga, Volume 3 (Saga (Collected Editions) #3)",21.57,In stock,../media/cache/d8/fd/d8fd30b3e5781e880a3efe4c9495b417.jpg,Five
Running with Scissors,12.91,In stock,../media/cache/66/c7/66c7a1537c8901e1e4ec217d1956bae8.jpg,Four
Rogue Lawyer (Rogue Lawyer #1),50.11,In stock,../media/cache/92/e4/92e4e180ba8fbde3b8ac0c1e71cfc5f4.jpg,Three
"Rise of the Rocket Girls: The Women Who Propelled Us, from Missiles to the Moon to Mars",41.67,In stock,../media/cache/05/42/05428b0c7b79d0dbc521fd621e754083.jpg,Four
Rework,44.88,In stock,../media/cache/54/10/5410a58193e2373c04b3021ade78a82b.jpg,Two
Reservations for Two,11.1,In stock,../media/cache/39/a4/39a4d96a5bc75a34aae97676a4b854fa.jpg,Three
Red: The True Story of Red Riding Hood,28.54,In stock,../media/cache/70/4e/704e81b05e56dd84ecf607ea283952db.jpg,Three
Ready Player One,19.07,In stock,../media/cache/51/34/513418bd1c6114f3ea1fd703278e20ef.jpg,Four
Quiet: The Power of Introverts in a World That Can't Stop Talking,43.55,In stock,../media/cache/ee/3a/ee3aebe36d1d0fa11a95a07067294b8c.jpg,One
Prodigy: The Graphic Novel (Legend: The Graphic Novel #2),43.63,In stock,../media/cache/c9/a5/c9a559e3ba407c1d70ebfc4e2f0d82db.jpg,Three
Persepolis: The Story of a Childhood (Persepolis #1-2),39.13,In stock,../media/cache/14/98/14987a55d9609e706d2619814e2a8b0a.jpg,One
Packing for Mars: The Curious Science of Life in the Void,56.68,In stock,../media/cache/8d/72/8d7216b05e1b5edf9bdb0d2db295ca33.jpg,Two
Outliers: The Story of Success,14.16,In stock,../media/cache/70/37/70372ab3240019fbe2de6cd407c98675.jpg,One
Original Fake,31.45,In stock,../media/cache/e7/29/e72934871f9b42a807d976670a446e12.jpg,Three
Orange Is the New Black,24.61,In stock,../media/cache/d9/ea/d9ea34aea25469189bca07af6a18790a.jpg,Two
One for the Money (Stephanie Plum #1),32.87,In stock,../media/cache/4e/52/4e52f087337abef25de62845f093ed6e.jpg,Two
Notes from a Small Island (Notes From a Small Island #1),40.17,In stock,../media/cache/61/39/61393c43f7caaccaa07daccaa8530736.jpg,One
Night (The Night Trilogy #1),13.51,In stock,../media/cache/e3/cc/e3ccf96311f9c1b9e9ecc80e16c05f4e.jpg,One
Neither Here nor There: Travels in Europe,38.95,In stock,../media/cache/06/81/0681530a7bc301caf5c3257e1b0f0750.jpg,Three
Naked,31.69,In stock,../media/cache/e7/12/e71268a559d73826aa64151d47357a12.jpg,Three
Morning Star (Red Rising #3),29.4,In stock,../media/cache/b5/f0/b5f04530d0343e763a80ef3f2dbdb386.jpg,One
"Miracles from Heaven: A Little Girl, Her Journey to Heaven, and Her Amazing Story of Healing",57.83,In stock,../media/cache/7c/8e/7c8ea0cef3825cc6ddae55267c55a59e.jpg,One
Midnight Riot (Peter Grant/ Rivers of London - books #1),55.46,In stock,../media/cache/e6/57/e6574a313ad7e6adf97a1d71318f9a7f.jpg,Two
Me Talk Pretty One Day,57.6,In stock,../media/cache/98/9f/989fe700e9e6bdec4fc3217daa5b7df3.jpg,Two
Manuscript Found in Accra,34.98,In stock,../media/cache/26/b7/26b72a3c1cf2a8afdbe92fa1a1d78f41.jpg,Two
Lust & Wonder,11.87,In stock,../media/cache/61/ba/61ba5bc1ee3d8cb3dd350120ffa3f31e.jpg,Two
Lila (Gilead #3),12.47,In stock,../media/cache/2b/99/2b99a765a013979637b4a6726bfb10f5.jpg,Three
"Life, the Universe and Everything (Hitchhiker's Guide to the Galaxy #3)",33.26,In stock,../media/cache/ef/8b/ef8bc5adcd3bea8e8ba97be76d07a32a.jpg,Two
Life Without a Recipe,59.04,In stock,../media/cache/80/b3/80b3e38be4204b3b64cdbe8c80dcf1f9.jpg,Five
Life After Life,26.13,In stock,../media/cache/59/80/59803a88c2e5dd7a2e36de1d41f7f1ae.jpg,Two
Letter to a Christian Nation,22.2,In stock,../media/cache/74/c2/74c2893188f917409ba564d46f481f77.jpg,One
Let's Pretend This Never Happened: A Mostly True Memoir,45.11,In stock,../media/cache/78/e1/78e1b9ccc99ba11d78015f0a18f0b421.jpg,One
Legend (Legend #1),43.69,In stock,../media/cache/6c/6c/6c6c0984ab57d6b4f71d84dd0db0f65b.jpg,Four
"Lean In: Women, Work, and the Will to Lead",25.02,In stock,../media/cache/4f/e5/4fe55bc7134401f6db04f0775ead1d4c.jpg,One
"Lamb: The Gospel According to Biff, Christ's Childhood Pal",55.5,In stock,../media/cache/a1/03/a10370da29e4ba78c7a75a14041eae0e.jpg,Five
Lady Renegades (Rebel Belle #3),53.04,In stock,../media/cache/d2/c2/d2c259e13fe3097325549a14f996b462.jpg,Five
Jurassic Park (Jurassic Park #1),44.97,In stock,../media/cache/9a/71/9a7160b396790bd4a351522278de4f8c.jpg,One
It's Never Too Late to Begin Again: Discovering Creativity and Meaning at Midlife and Beyond,42.38,In stock,../media/cache/fa/36/fa3659740e31eb57775cc2647654bf11.jpg,One
Is Everyone Hanging Out Without Me? (And Other Concerns),20.11,In stock,../media/cache/6b/94/6b94e98f822a42c03c4ff0b9cfdd6e0c.jpg,Three
Into the Wild,56.7,In stock,../media/cache/e2/ca/e2ca3b870db8071034edea19b1da3de2.jpg,Five
Inferno (Robert Langdon #4),41.0,In stock,../media/cache/e3/11/e3111146083821b5a3670d869ab40d2a.jpg,Five
"In the Garden of Beasts: Love, Terror, and an American Family in Hitler's Berlin",28.85,In stock,../media/cache/25/82/2582a9f11ad68a30e44cc0b459383474.jpg,Three
If I Run (If I Run #1),49.97,In stock,../media/cache/c3/d0/c3d0f2fb5cacbca64639a679b962e1b9.jpg,Four
I've Got Your Number,19.69,In stock,../media/cache/b2/df/b2df826432771838819db89c20e20609.jpg,One
I Am Malala: The Girl Who Stood Up for Education and Was Shot by the Taliban,28.88,In stock,../media/cache/52/7a/527a7d3b9b4928c093cadd75661bf467.jpg,Two
Hungry Girl Clean & Hungry: Easy All-Natural Recipes for Healthy Eating in the Real World,33.14,In stock,../media/cache/6f/c4/6fc450625cd672e871a6176f74909be2.jpg,Three
"House of Lost Worlds: Dinosaurs, Dynasties, and the Story of Life on Earth",43.7,In stock,../media/cache/43/fd/43fda1db93163d67705264dcfa98aaa5.jpg,Two
House of Leaves,54.89,In stock,../media/cache/14/25/142563ccee483bc07632f9c083a68326.jpg,One
Horrible Bear!,37.52,In stock,../media/cache/d2/63/d26337dee5c0b13b56b7aea59d611570.jpg,Two
Holidays on Ice,51.07,In stock,../media/cache/4b/9a/4b9a2a6d4c995e12fe216f6173a582be.jpg,Two
Heir to the Sky,44.07,In stock,../media/cache/6d/b1/6db1568e09d10652593638a5f85e7202.jpg,Four
Green Eggs and Ham (Beginner Books B-16),10.79,In stock,../media/cache/3a/0e/3a0e75e4f758f90a80965869afbe41b4.jpg,Four
"Grayson, Vol 3: Nemesis (Grayson #3)",42.72,In stock,../media/cache/f9/4c/f94cfc3c82abb799568d1ea029b1d3d1.jpg,One
Gratitude,26.66,In stock,../media/cache/07/b6/07b673e7d367a5e89418bd513a8d5e72.jpg,Five
Gone Girl,37.6,In stock,../media/cache/24/ad/24ad42075b1aa1403aef934c29c1e8ba.jpg,Five
Golden (Heart of Dread #3),42.21,In stock,../media/cache/39/2f/392fedbcda7bf8f968d5e6643ea5545f.jpg,Four
Girl in the Blue Coat,46.83,In stock,../media/cache/bf/7a/bf7a5bc1d1ebac5e9b6fbb147828a123.jpg,Two
"Fruits Basket, Vol. 3 (Fruits Basket #3)",45.17,In stock,../media/cache/7b/e7/7be75475a916d6df4edebfc5fe36c3f9.jpg,Two
"Friday Night Lights: A Town, a Team, and a Dream",51.22,In stock,../media/cache/7d/cf/7dcf6c3b419bf7e7e3b3b8162b177869.jpg,Three
Fire Bound (Sea Haven/Sisters of the Heart #5),21.28,In stock,../media/cache/cd/53/cd53431a069ee01572988de29ef68da5.jpg,Four
Fifty Shades Freed (Fifty Shades #3),15.36,In stock,../media/cache/18/d8/18d8e02c75c2ef23556c9746fae57e43.jpg,Five
Fellside,38.62,In stock,../media/cache/f4/8f/f48f179d6bda290b66b2d165e0a419e6.jpg,One
Extreme Prey (Lucas Davenport #26),25.4,In stock,../media/cache/de/86/de86d4f1563fad2ca088922fbbb2b36a.jpg,Three
Eragon (The Inheritance Cycle #1),43.87,In stock,../media/cache/2d/62/2d625f26cb3bbeef851221f125b81daf.jpg,Three
Eclipse (Twilight #3),18.74,In stock,../media/cache/05/f8/05f833af99c37decb506e34e36f5cdaf.jpg,One
Dune (Dune #1),54.86,In stock,../media/cache/7a/bc/7abccb865ecf9b0f676800b10c71cfd6.jpg,One
Dracula,52.62,In stock,../media/cache/ef/d7/efd7c316b4d60a403ba6d111fdeb2d41.jpg,Three
Do Androids Dream of Electric Sheep? (Blade Runner #1),51.48,In stock,../media/cache/fa/65/fa653fbe3a4c69227c9b79d471cee576.jpg,One
Disrupted: My Misadventure in the Start-Up Bubble,15.28,In stock,../media/cache/2c/32/2c32dd01215c98fc1f6b176b6a9b3ece.jpg,Five
Dead Wake: The Last Crossing of the Lusitania,39.24,In stock,../media/cache/69/0e/690ee5b7ef94ea460861eee2e67fd787.jpg,Five
"David and Goliath: Underdogs, Misfits, and the Art of Battling Giants",17.81,In stock,../media/cache/df/95/df9520adbabbb17f22fcb3f49c69640f.jpg,One
Darkfever (Fever #1),56.02,In stock,../media/cache/af/08/af08d08c90b4df63ca5a2819a754da18.jpg,One
Dark Places,23.9,In stock,../media/cache/51/bf/51bf575f9af355f4f9f98abe8986402a.jpg,Five
Crazy Rich Asians (Crazy Rich Asians #1),49.13,In stock,../media/cache/9a/62/9a621372fed3a80015283013d8a452cd.jpg,Five
Counting Thyme,10.62,In stock,../media/cache/e0/ae/e0ae97753a73b88b61b13b19977613dc.jpg,One
Cosmos,36.17,In stock,../media/cache/65/7b/657b1d20ea50775c5c87e039ed8aeebc.jpg,Two
Civilization and Its Discontents,59.95,In stock,../media/cache/4d/a6/4da6939a6bbd895a5acdeabad46d1f9f.jpg,Two
Cinder (The Lunar Chronicles #1),26.09,In stock,../media/cache/4e/d2/4ed2ec75df84ba1093fc4141b29abab3.jpg,One
Catastrophic Happiness: Finding Joy in Childhood's Messy Years,37.35,In stock,../media/cache/7d/0b/7d0bb832760e81c281d8d283ba6a2b09.jpg,Two
Career of Evil (Cormoran Strike #3),24.72,In stock,../media/cache/9e/ff/9eff8b66d583e8f0ba58a0bc86de40f2.jpg,Two
Breaking Dawn (Twilight #4),35.28,In stock,../media/cache/ce/24/ce242d3eb00bf1938d6c18e0261ef868.jpg,Five
Brave Enough,51.32,In stock,../media/cache/94/c7/94c7add56827e01998189a021ec060e2.jpg,Five
Boy Meets Boy,21.12,In stock,../media/cache/0b/ac/0baceb72d202880d1441a32193df6e11.jpg,Three
"Born to Run: A Hidden Tribe, Superathletes, and the Greatest Race the World Has Never Seen",27.35,In stock,../media/cache/ea/ee/eaee98b302dcaf91d1122816ae553295.jpg,Two
Blink: The Power of Thinking Without Thinking,21.74,In stock,../media/cache/5d/41/5d415bc31b1f856a2a9dc8706fd19abd.jpg,Five
Black Flags: The Rise of ISIS,40.87,In stock,../media/cache/48/5d/485d2c4cedd639fcb005340a8d589bb3.jpg,One
